title,label
"Behind Monsanto Deal, Doubts About the GMO Revolution",0
5 New Big Tech Antitrust Bills Are A Put Up Or Shut Up Moment For Republicans,1
"Richard Lamm, Governor and Early Abortion Rights Supporter, Dies at 85",0
Trump Again Falsely Blames Democrats for His Separation Tactic,1
"Foreign Powers See No Military Solution in Syria, but Diplomacy Stalls",1
Dont Take Osteoarthritis Lying Down,0
"White House moves to sharper, populist message to keep Democrats together in make-or-break agenda moment",1
"Travel is back, but Omicron could change everything",0
Secret recordings show how presidents work,0
You Dont Have to Love the Tampa Bay Rays. You Just Shouldnt Hate Them.,0
Quilts Reveal Americas History,0
Samaje Perine active for Redskins vs. Broncos,0
Debate Scene: Democrats Gather in Las Vegas,0
Do Cryptocurrencies Such as Bitcoin Have a Future?,0
Trump avoids gun control talk in Las Vegas visit,1
Preventing This War,0
Pelosi slams Trump for abandoning coronavirus relief talks: 'White House is in complete disarray',1
Frustration With GOP Drove Trump to Deal With Democrats,1
How Charlottesvilles Echoes Forced New Zealand to Confront Its History,0
Colin Powell sees 'dark vein' of intolerance in Republican Party,1
Fixing Puerto Ricos Debt Mess,0
Cuomo to Appoint Special Prosecutor for Killings by Police,1
How DeVoss Cuts Would Hurt Special-Needs Kids,0
Can Obama Find Thumpin to Say?,1
Marxist attacks in Turkey: why rights activists fear fallout,1
here s how manchin s climate deal could make energy bills cheaper,0
The fight between Democratic candidates over socialism heats up,1
"Oil Prices Tick Up, But Sentiment Remains Cautious",0
I Used to Like School: An 11-Year-Olds Struggle With Pandemic Learning,0
Tech Giants Invest in New Dreams of Grandeur,0
The Libertarian Moment is Everywhere Around Us (Increasing Social Tolerance Edition),1
Lois Lerner Can Come Clean; Obama Said So,0
The fear I&ve been living with all my life,0
Democrats Defend Private Interviews in Impeachment Probe,0
Bringing the Theater Back to Life,0
Biden Is the Big Spender America Wants,1
The term &Asian American& has a radical history,1
"Chris Murphy dismisses Rand Paul criticism, says Trump impeachment has 'no comparison'",1
How to Talk to Your Republican Turkey About Obamacare,1
Trump calls McCain a lousy candidate whose campaign was run by deadheads.,1
Obama Defends Cash Payment to Iran,0
How To Fight Deplatforming: Decentralize,0
"In India, a clean sweep for honest governance",0
in a post work world israel s ultra orthodox point the way,0
Like We Dont Have Enough Problems: Trash Piles Up in Athens,0
Changing the Way We Talk About Libertarianism,1
Not Welcome Here': No Love for Trump on Mexico City Streets,1
Grandfather pleads guilty in death of toddler who fell from cruise ship in Puerto Rico,0
how billionaire robert smith avoided indictment in multimillion dollar tax case,0
"Trump Is Guilty of Numerous Felonies, Prosecutor Who Resigned Says",1
"New York Today: Welcome Back, Liberty",0
Chip and Joanna Gaines want you to know they&re good,0
Myanmars Leader Faulted for Silence as Army Campaigns Against Rohingya,0
White House talking points on Syria before Haley&s interview cite intended Russia sanctions,0
Scotts Police Reform Could Be a Key for GOP,0
Congress passes bill boosting US semiconductor production,0
American Meb Keflezighi Wins in Boston,0
Jason Chaffetz Says D.C. Officials Could Go to Prison If They Stop Busting People for Pot,1
"Bob Woodward on Trump&s pandemic response: &In covering nine presidents, I&ve never seen anything like it&",1
Justice Department inspector general report cites lack of candor by McCabe,0
Fashion Model Teddy Quinlivan Comes Out as Transgender,0
The Best Defense,0
Kyle Chandler Has Earned His Feel-Good Moment,0
The Inherent Vice Of This Film Is Its Lack Of A Reason For Existing,0
"Study: Vaping, pot on rise among teens, booze and cigarette use down",0
Biden says he no longer understands Republicans. He has a chance to figure the GOP out this week.,1
Mitch McConnell: Democrats want dictate hamburger consumption,1
"DSW Names New CEO, Blames Slow Traffic for Weak Results",0
Trump downplays North Korea missile tests amid stalled nuclear talks with Kim Jong Un,0
NBC News/WSJ poll: Sanders gains ground on Biden with black voters nationally,0
Trump angry at allies conceding he lost debate,1
Two Presidential Candidates Detained as They File to Run in Uganda,0
US Senate candidate from Louisiana smokes marijuana in new campaign ad,1
Qualcomms Quarter Overshadowed by International Challenges,0
Ivanka Trump spends hours testifying before Jan. 6 committee,0
"With no federal emergency declaration, San Francisco and New York sound alarm on monkeypox",0
hbo no go your game of thrones streaming woes dont matter,0
Trump normalizes foreign election intervention ahead of 2020,1
"Denounced by His Party as a Nazi, Arthur Jones Wins Illinois G.O.P. Congressional Primary",1
"Helicopter Carrying Injured Skier Crashes in Italy, Killing 6",0
Kevin McCarthy&s dishonest explanation for getting rid of Liz Cheney,1
I Was Betrayed by President Trump,1
"Who Is Larry Kudlow, Trumps New Economic Adviser?",0
America&s disdain for Black men and boys hasn&t diminished in the years since Trayvon Martin was killed,1
"This Is a Year to Forget, but Boeings 2021 Isnt Looking Great Either",0
"In Remote Thai Villages, Legacy of Chinas Lost Army Endures ",0
"Supreme Court Nominee to Be Announced Next Week, Trump Says",0
How likely is a pardon for &Making a Murderer& convict?,0
Justice Department drops case against ex-Trump adviser Michael Flynn,0
Democratic Donors Have Their Candidate,0
London Terror Suspect Pleads Guilty,0
Partisan squabbles shadow Congress& efforts to lower drug prices,1
How Texas Is Punching Back At An Establishment Obsessed With Killing Babies,1
"Kim Gordon on Catherine Breillat, Comedians and Her Rodarte Football Jersey",0
The Freeing of the American Mind,0
How to Get Rid of a Tattoo Youve Outgrown,0
Boston bomber Tamerlan Tsarnaev told FBI he never picked a fight,0
Opinion: The trouble with Trump's Russia reset,1
An N.B.A. Coachs Journey from FedEx to the Top Job,0
"Trump Doctrine is 'We're America, B----,' senior administration officials say",1
When Should We Be Sorry?,0
Trump&s tax bill: Smaller than you think?,1
Effort to ease Russian sanctions boosted by former Louisiana senator,0
Republicans Hope Cleveland Rocks For Them in 2016,1
Trump&s praise complicates Youngkin&s attempted pivot to the political middle in Virginia,0
1962: The Bumbling Beginning,0
"Mail bomb suspect Cesar Sayoc to plead guilty in spree targeting Obama, De Niro, CNN",0
UBS Taps Former Commerzbank Chief Martin Blessing,0
A Question Still Hanging at the Met Breuer: Why?,0
Virginia Raggi of Five Star Movement Sweeps Election for Romes Mayor,0
"Senate averts trade filibuster, delivers big win to Obama in fast-track fight",1
"Did Trump Kill Off a Two-State Solution? He Says No, Palestinians Say Yes",1
"Voting rights battles in Georgia, Texas loom over midterm elections",1
Avis Posts Loss Amid Strong Dollar,0
"Univision, NBC & Macy&s dump Trump -- he doesn&t budge",1
Judging Spinoza,0
How Adventure Time Became a Talent Factory for a Generation of Animators,0
Iran Pays Afghans to Fight for Assad,0
The Best and Worst Airlines of 2015,0
Fox Poised to Win Rights to NFL Thursday Night Package,0
When American Soldiers Met Vietnamese Cuisine,0
Family asks FBI to probe black Muslim teen&s hanging,1
Trump unwilling to compromise on deal for border security funding even as allies float potential solutions,1
Maduro: Trump trying to start a war over oil in South America,1
"The Thunder of Giants, by Joel Fishbane",0
Trump Says of U.S. Intel: 'I Want Them to Be Sure' About Russia Hacks,1
in venice harry styles talks acting music and fans,0
Obama Wades Into Election Debate With Indiana Speech,1
Best of the Web Today: Honesty and Policy,0
Trump Shows How to Smother a Scandal: With a Bigger Story,1
"In Netanyahu&s hour of need, Trump is nowhere to be seen",1
White House announces formal support for D.C. statehood bill,0
Washington Neighborhood Devastated by Wildfire,0
Trump Administration Sees No Threat to Economy From Monopolies,0
"Kendrick Lamar, Drake and Childish Gambino reportedly turned down the Grammys",0
Trump&s immigration policy (or what we know about it) in 13 illuminating tweets,0
Obama's Trade Agenda Fails Key Test From Senate Democrats,1
Rick Perry casts doubt on win of first openly gay student president at Texas A&M,1
Kris Jenners Secret to Making the Best Deals,0
Bidens Infrastructure Double-Cross Gives Republicans Legislative Leverage,1
Donald Trump Visits Flood-Damaged Louisiana Area,0
Election 2016: On the campaign trail,0
From Artists Hand to Shops Counter: The Whitney Teams Up With Tiffany,0
Sorrow in the Stands,0
Australian Student Reportedly Detained in North Korea,0
Grown-Ups Fight for Childrens Right to Sell Lukewarm Lemonade,0
Live Updates: India&s Narendra Modi and Donald Trump visit Houston,0
Sen. John McCain to lie in state. Here&s what that means,1
macron sees difficult days ahead for france amid covid surge,0
AG Lynch: President Will Call On Congress to Take Action on Guns in San Bernardino Address,1
California Chrome Wins Preakness,0
"Brad Pitt, Leonardo DiCaprio turned down 'Brokeback Mountain,' Gus Van Sant says",0
Republicans Discuss Geopolitics at Thanksgiving Table in Iowa,0
Palanks Take: Appeals Court Upholds Former Sentinel Chiefs Conviction,0
Hispanic rights groups protest fed plan to revoke amnesties,1
Nancy Pelosi and Chuck Schumer tell Republicans to accept projected Trump loss and move on,1
The Sabotage Years,0
"Anthony Scaramucci, John Kelly, Venezuela: Your Tuesday Briefing",0
Texas 31st Congressional District Primary Election Results,0
"Iran's only female Olympic medalist appears to defect, criticizes regime",0
Hanoi House,0
Bad Banks Spread Across China,0
"Trump's auto tariffs will cost consumers $83 billion, insiders tell Commerce in hearing",1
"Full circle': Activist fought Philippine dictator, now his son",0
"Go West, Democrats",0
How Would the Repeal of Obamacare Affect You?,0
Trump on Virginia Gun Dispute: 2nd Amendment Under Very Serious Attack,1
Greek court rules far-right Golden Dawn leaders ran a crime group,1
What happened in the Senate on Wednesday is about a lot more than Franken,0
Congress isn&t doing its job -- or anything close to it,1
William Rehnquist Proposed to Sandra Day O'Connor When They Were in Their 20s,0
When a Dance Collective Was Like a Rock Band,0
How slavery haunts today&s America,0
Senate Democrats again block procedural vote on coronavirus bill,1
"John Hinckley Jr. on track to have conditions of release lifted this summer, his lawyer says",0
Trump Bets on Long Game With China,1
Economic Anxieties Confront Candidates,1
What John Bolton gets wrong about coup attempts -- and Donald Trump,1
Low-income NYC Students Get a Shot at the Spotlight,0
Joe Biden&s pledge could change the look of the Supreme Court,0
Kamala Harris: I wouldn't say there's no evidence of new Kavanaugh allegations,0
House Democrats ask to delay Supreme Court arguments over Mueller docs,1
Nationals draw huge crowd at White House,0
The New York Times takes it on the chin after asking for help finding 'false information',0
Trumps Carrier Shakedown,0
"In Harlem and Detroit, Fans Pay Respect to Aretha Franklin",0
"Oregon outlaws gay conversion therapy, joining two other states",1
What&s next for Paul Ryan?,0
Obamas Political Bank Run,0
Conan O&Brien surprises Patriots Super Bowl hero with new truck,0
GOP governor cuts $16 million from budget to take anti-abortion stand,1
The Immoral Double Life of the Former King of Spain,0
Senior Aides in Boris Johnsons Government Quit Amid Scandal Over Lockdown Parties,1
How Republican Lawmakers Responded to Trumps Russian Meddling Denial,0
"Buddy Roemer, Reformer as a Louisiana Governor, Dies at 77",0
"Shell in the Arctic: Please, Mr. Obama, may we drill some more?",1
"U.S. faces worse-than-average hurricane season, Trump told",0
G.O.P. on Fire Bombing in North Carolina,0
"JOSEPH CURL: At Christmastime, George W. Bush was Santa, Obama is Scrooge",1
"Damien Hirsts Post-Venice, Post-Truth World",0
Trump says he will not debate Sanders,0
The Brooklyn Man Who Set Out to Track Every Jew Lost to Covid,0
The Pit Bull Gets a Rebrand,0
Donald Trump eyes executive order tying foreign aid to religious freedom,1
Trump&s rally in Texas shows exactly why he&s so dangerous,1
"Trump Declares Emergency Over Wall, Inviting Likely Court Fight",1
Songbird Not Hearing Bidders Higher Note for Canary Wharf,0
Obama to GOP: 'So sue me',1
BofA's Head of Global Prime Brokerage in Talks to Leave,0
Indiana Governor Says Legislators May Clarify Religious Beliefs Law,0
Mets great Dwight Gooden arrested for second time in 6 weeks,0
Kiss of death': Advocates warn Democrats' voting bill could harm immigrants,1
&Doctor Sleep& shines bright before flaming out down the stretch,0
U.N. Court Orders Myanmar to Take Steps to Protect Rohingya Muslims,0
"Start your Monday smart: Oscars, North Korea, Cohen, US-China trade, Cuba votes, CPAC",0
Justice Kavanaugh's neighbors fed up with raucous protests,1
Google's new app helps anyone be a scientist,0
"Leopoldo Lopez, imprisoned Venezuelan opposition leader, remains defiant",0
NBA star Karl-Anthony Towns says he has lost 7 family members to Covid-19,0
Prison Bonds Are Going Through the Roof Thanks to Trumps Immigration Policy,1
Inquiry Seeks Twitter User in Brooklyn Bridge Flag Case,0
What Freedom Looks Like,0
Zakaria: Why Trump won,0
Theres Nothing Left: Why Thousands of Republicans Are Leaving the Party,1
11 of Our Best Weekend Reads,0
"House Votes to Hold Scavino, Navarro in Contempt of Congress",1
Poor Morale in Hong Kong Portends Lower Turnout for July 1 March,0
The Shed Opens: What Our Critics Think,0
Sotomayor to Justice Department Lawyer: 'We Can't Keep Bending the Fourth Amendment to the Resources of Law Enforcement',1
4 theories on why Hillary Clinton isn&t very popular right now,1
economists say more roads and bridges,0
The Trumpkins Lament,1
Dave Chappelle releases first statement about &unsettling& attack,0
Must cigarette packaging be bland and indistinct? British High Court says yes,0
jack white marries musician olivia jean at detroit show,0
"Donald Trump calls the media an enemy of the state, Obama treated it as one",1
"Parihan Rahman, Kevin-Michael Porras",0
Trump Renews Attacks on Comey Before Turning to Praise of Korean Talks,1
4 Things Conservatives Can Learn From Taylor Swift,0
"Despite What Democrats Said at Their Debate, We're Not Heading Toward Climate Apocalypse",1
Welcome Guest Appears at Play on Wimbledons Middle Sunday,0
Ohio Gov. Mike DeWine tests negative for coronavirus for second time after false positive,0
"Jennifer Eng, John San Filippo",0
Wray hints to FBI staff that coming IG report played role in McCabe departure,1
"On the Campaign Trail, Obama Is Hard to Find",1
Donald Trump terrorizes swamp: 'We will be back',1
Trey Gowdy: Republicans have investigated Ivanka Trump emails more than Democrats did Benghazi,1
Bad Ass and Blind': Meet Singer-Songwriter Raul Midón,0
Senate Democrats to boycott committee vote for Amy Coney Barrett,1
Kirk blasts GOP leaders for inaction on Supreme Court nominee,1
Takeda Shares Fall as Investors Queasy Over Possible Bid for Shire,0
"Kal Penn, &Harold and Kumar& and &House& star, comes out as gay",0
US Navy officers lose jobs after fatal collision,0
Escheating scandal?,0
"Who Won the Democratic Debate, Night 2? Experts Weigh In",0
weather bomb set to hit ireland as storm sweeps across nation,0
Seeing the World by Drone,0
"El Chapo, Escaped Mexican Drug Lord, Is Recaptured in Gun Battle",0
"Three months out, the presidential election is still being overshadowed",1
The Mardini,0
"With Power Grabs in the Midwest, G.O.P. Risks a 2020 Backlash",1
Britain Urged to Step Back in Feud With E.U.,0
Lawmakers Question Trump Nominee to Oversee Stimulus,1
sensetime relaunches hong kong ipo trading to start dec 30,0
Holy Smokes: Its Juan Martin del Potro,0
My family saw a neighborhood get paved over. Don&t let it happen again,0
scholz steps up campaign to abolish gender pay gap in sports,0
Two top New York public prosecutors rejoin private practice.,0
Time to put Mad Maxine Waters out to pasture,0
"Joe Biden reacts to Kavanaugh allegation, reviving memories of Anita Hill hearing",0
How Mobile-Game Makers Account for Magic-Wand Sales,0
North Korea: Is Kim Jong Un &the world&s most dangerous man&?,1
"In Texts, F.B.I. Officials in Russia Inquiry Said Clinton Just Has to Win",1
Kelly Clarkson is not here for your body shaming,0
dutch watchdog rules klm s carbon zero ad is misleading,0
The Obama-McConnell Dance Begins,0
"Adele pole dances at London nightclub, sending fans crazy",0
Beating suspects' smiling mugshots shock Ole Miss community,0
McConnell 'Suspicious' of Obama's Handling of Iran Nuclear Negotiations,1
4 Takeaways From Tuesdays Primaries,0
Jamaica Has Never Had Olympic Synchronized Swimmers. These Girls Want to Change That.,0
Republicans Grill IRS Chief Over Lost Emails,1
Flint: Hot water for Michigan governor after emails go public,1
"American companies bring jobs back to the U.S., and Democrats smirk",1
"At South Carolina Rally, Kanye West Gives Emotional Speech On Abortion: I Almost Killed My Daughter",1
ObamaCares GOP Preservers,0
Memorable State of the Union speeches,0
where the candidates to replace boris johnson stand on uk taxes,0
Melania Trump focuses on Covid and slams Democrats for politicizing pandemic in campaign speech,1
"Behind the Yankees: Their Best Days, and A.L. East Foes",0
Kanye West criticizes Obama and praises Trump: &The mob can&t make me not love him&,1
"Randolph Braham, 95, Holocaust Scholar Who Saw a Whitewash, Dies",0
Steady as She Goes on Faithless Electors,0
Angelina Jolie&s former company accuses Brad Pitt of &waging a vindictive war& in new countersuit over winery,0
"Meet Maysa, a young refugee who put her brother first",0
Brickbat: Stay in the Closet,0
Body of missing actor Charles Levin believed found by Oregon authorities,0
3-D Printed Guns and Jurisdiction Over Out-of-State Attorneys General,0
How new rules at Facebook and Twitter led to a warning beneath a Trump retweet,0
Pop star Troye Sivan returns to acting in 'conversion therapy' drama 'Boy Erased',0
Texas 35th Congressional District Runoff Election Results,0
Mark Kirk apologizes for using Tammy Duckworth&s Thai heritage in debate jab,0
"What You Get for $895,000",0
ABC News Tries To Pass Off Video Of Kentucky Gun Range As Slaughter In Syria,1
Brexit Turns U.K. Parliament on Its Head,0
"5 things for August 28: Harvey, USS John McCain, President Trump, Alps deaths",0
The 6 Most Philly Moments Of The Eagles Playoff Run,0
Donald Trump charges 'fake news' after CNN producer caught saying Russia story is about 'ratings',1
serbia to reduce moscow flights after criticism president says,0
Trump&s war on reality is truly baffling,1
LeBron James on Jacob Blake shooting: 'We are scared as Black people in America',1
Jeff Bezos Is Sued by His Girlfriends Brother,0
"Jeb Bush Says Campaigning is a Long Haul, Calls for Patience",0
Minnesota Attorney General Primary Election Results,0
Christie Wants Obama to Push Cuba to Return New Jersey Troopers Killer,1
John Lewis 'honored and blessed' to throw out first pitch,0
How to Plan for Part-Time Retirement,0
Bosnia sees smaller protests after days of violent rioting,1
US B-1 bombers ready if called upon by Trump,1
"Air in Delhi is world's worst, 13 other Indian cities aren't far behind",0
"One of the Them Will Win, But Donald Trump & Hillary Clinton Are Unacceptable To Most Voters",1
"Before Rachel Dolezal, there was Walter White ",0
Obama Takes Time Out to Remind Voters of Economic Progress,0
Female war hero leads new wave of veteran candidates,0
The Paradox of American Anti-Semitism,1
Five Best: Samantha Ellis on Spinsters,0
Trump expected to tap State Department spokeswoman Heather Nauert for new U.N. ambassador,0
Republicans unnerved by failure of Trump's ground operation,1
Dear Berkeley: Even Ann Coulter deserves free speech,0
Opinion: The one thing that terrifies White nationalists is what makes America great,1
Jimmy Kimmel Rags on Trump for His Randy Quaid Retweets,1
"Ann McBride Norton, First Woman to Run Common Cause, Dies at 75",0
Trumps Twitter Habit Draws Low Marks,1
N.F.L. Players Arent Sold on Proposed 17-Game Season,0
Joe Biden Says U.S. Is Still Backing Ukraine,0
"Election Day Federalist Radio: Polls, Swing States, And Voter Turnout",0
The Legal Challenge to ObamaNet,0
Muslim comedian sits next to Eric Trump on trans-Atlantic flight,0
"As Conflict With U.S. Grows, Some Iran Hard-liners Suggest Talking to Trump",0
Supreme Court Lets Trump Travel Ban Take Effect for Now,1
Ex-DOJ attorney: Trump criticism of immigration judges led to resignation,1
"Corrections: October 2, 2018",0
"US Vice President Mike Pence was set to meet with North Korean officials, but they canceled",0
American Music Awards 2021: Who&s hosting and what to expect,0
Kamala Harris' prosecutor past threatens 2020 White House bid,1
Browns fan goes on rant and jumps into Lake Erie after revenge loss to the Pittsburgh Steelers,0
morikawa horschel look to make history in dubai finale,0
"SantaCon Fights for the Right to Party, Responsibly",0
Three recent Christian Science Perspective articles,0
The Best of Week 9 in the N.F.L.,0
german envoy signals pipeline may be targeted if russia invades,0
Trump pressured Sessions on multiple occasions to overturn recusal,1
Review: Jason Craigs Longyarn Features a Mom Who Wont Shut Up,0
School district pushes back against criticism over Arab stereotype in shooting drill,0
youtube removes video of trump from jan 6 committee hearing,1
Jordan Spieth Is a Round Away From a Fantastic Finish,0
Sinn Fein leader Adams charges unlikely according to analysts,0
Rep. Duncan Hunter says he will resign after the holidays following guilty plea,0
"Peter Donat, Actor Who Played a Panoply of Roles, Dead at 90",0
"Matz, Syndergaard Suffering From Bone Spurs",0
"The Supreme Court upholds Obamacare, but its supporters shouldn't breathe easy",1
Berkeleys Antifa Takeover Shows There Is Evil On Both Sides,1
Jury Deliberations Appear to Break Down in Aleynikov Case,0
Bernie Sanders has been saying similar things on CNN for years,0
Trump Says Apple CEO Has Promised to Build 3 Plants in U.S.,0
"Trump's regulatory rollbacks, from net neutrality to campus sex assault",1
"Trump may hold off on more endorsements for coming primaries, advisers say",0
Trump Says Hes Torn on China Deal as Advisers Signal Harmony on Trade,0
Reagan&s racist call with Nixon echoes strongly today,1
Between Trump and his national security adviser lie &ferocious& internal politics,1
Brickbat: I Hear You Knocking,0
"For Republicans, Mar-a-Lago search offers new chance to rally around Trump",1
Hillary Clinton changes her tune on Republicans,0
"With 'Labor Day,' Reitman close to 'nailing it'",0
Anti-Corruption Group Finds Fault With European Union,0
Yankees Plan to Honor Four Former Players,0
"Review: The Threepenny Opera Returns Home, Liberated",0
Nancy Pelosi backs Jerrold Nadler: 'I think that the attorney general should be held in contempt',1
Donald Trump&s clueless immigration plan,1
More Cubans head for U.S. after policy change rumors,0
Is Obama a success or failure?,1
Trump to visit South Korea amid stalled talks with the North,0
Im a College Student With a Disability. Stop Treating Me Like a Child.,0
"New Italian Premier, in First Speech, Outlines Early Priorities for His Tenure",0
"Donald Trump, Mike Pence meet for first time since Capitol riot",0
"5 things for Wednesday, May 31: Afghanistan bombing, Russia investigation, Portland train stabbing",0
Young ISIS recruit: I was blinded by love,0
Hillary Clintons Hillblazers List Is a Whos Who of Big Donors,0
What Andy Cohen got out of Kim Kardashian West,0
"In Two Weeks, a New Governor of New York",0
10 Recipes Readers Love (None of Them Turkey),0
Trump's Call to End the Visa Lottery Is Cynical Politics at Its Worst,1
Boston bomber Tsarnaev faces death: Legalized revenge?,1
November date set for landmark Myanmar elections: What&s at stake?,0
Jurors Could Not Believe That a Reasonable Officer Would Have Done What Derek Chauvin Did,0
kaisa suspends trading amid uncertainty over debt repayment,0
Be a leader' — Perry tells Obama to confront border crisis,1
Donald Trump and Chris Christie Cancel Campaign Events Because of Hurricane,0
"5 things to know for June 19: DACA, coronavirus, police reform, Facebook, economy",0
"Top Republicans break with Trump, say FBI acted appropriately",1
Mexico to US: You think caravans are tough for you?,1
"Georgia Engel, 'Mary Tyler Moore Show' star, dies at 70",0
California Election Results: 15th Congressional District,0
Why Kavanaugh Should Not Attend the White House Ceremony,0
LETTER TO THE EDITOR: Obama will do anything for a legacy,1
Can Trump be trusted on judicial appointments?,1
Why Alabama Young Republicans deserted Roy Moore,1
"Sean Spicer, spokesman: Trump will not apologize for 'putting safety of country first and foremost'",1
China may wait it out rather than deal with Trump,0
"Maxine Waters Says She Will Never, Ever Forgive Black Voters Who Dont Do What She Says",1
Pregnant Woman Save Families From Fire,0
The Space-Age Story Behind the Metropolitan Operas Chandeliers,0
"Trump Criticizes Investigators, Citing Unrevealed Conflicts of Interest",1
"Sorry, Lady Gaga, but blocking Trump in Electoral College is mission impossible",1
Ten Models We Loved a Lot This Year,0
Comey: &No idea& what Mueller will conclude -- &I also don&t care&,1
Indiana teen pleads guilty to murdering cheerleader pregnant with their baby,0
"Shifting Fervor, and Favorites, in the Presidential Race",1
Inside Politics: GOP debate over policy and personalities,0
