title,label
"Trump Plays Down Coronavirus, Plans to Debate Biden",0
"This Time Probably Isnt Different for Fannie, Freddie",0
Europes Scramble for Africa,1
Indiana's RFRA—and the Response—Is All About the Signaling,0
Iran angling for invite to Chinese-led security pact after years of waiting,0
"To fix America, copy Texas",1
Americans Know More About Civics Than They Did a Year Ago,0
This is devastating for Trump,1
Hillary Clinton Protects Left Flank With TPP Opposition,1
Democrats await decision on whether immigration can be in Build Back Better,0
Dont Rush to Dismiss Medicare for All,0
"Mike Pompeo, CIA director, says nuclear war with North Korea is not 'imminent'",0
Angela Lansbury Is Right: Women Need Take Responsibility When They Contribute To Bad Sex Situations,0
"Reason-Rupe Poll: 'Millennials Aren't Liberals, They're Social Liberals and Fiscal Centrists'",1
Justice Breyer argues against expanding the Supreme Court,0
China's chilling surveillance shows U.S. need to slow AI roll,1
The New Vocabulary of 2021: A Lexicon of Peeves and Passions,0
Republicans Offer Different Opinions on Potential Sessions Recusal,0
Uber and Lyft Just Cant Stop Flouting the Law,0
Van Jones: We need to try to understand President Trump,0
Super PAC to drop $10 million on pro-Jeb Bush ads,0
"여호와의 증인, 병역 거부 이유로 한국에서 주홍글씨 낙인",0
Kurt Russell prefers to keep his politics personal,0
Ben Carson: 'People Are Shocked ... I Never Saw Rocky',0
House Republicans Condemn Democrat Plans To Pack The Supreme Court If They Lose Confirmation Battle,1
Brazil Protesters Find Hero in Crusading Judge,0
Griner could face 10 years in prison after guilty plea,0
google fights gmail privacy lawsuits bid for class action status,0
"FDA advisory group rejects Covid boosters for most, limits to high-risk groups",0
Thirteen years later,0
The Mooch&s Worst Week in Washington,0
Morning Joe Row Is Fresh Sign of TVs Iron Grip on Trump,1
Student arrested for wearing gorilla mask to Black Lives Matter rally cleared of most charges,1
Super Delegates…to the Rescue (of Hillary Clinton)!,1
Jeffrey Epsteins Death Creates Legal Morass for His Accusers,0
Donald Trump uses economy as Republican campaign advantage,0
"Xi vs. Trump: Chinese leader praises globalization, warns of trade wars at tony Davos summit",1
Russia gloomy on US relations after Democrats take House in midterms,1
Measles cases hit new high in U.S. since virus was declared eliminated in 2000,0
Sanders to Participate in Ohio Debate,0
Ecuador's Correa Faces Election Test,0
"Walmart Subsidiary Discriminated Against Transgender Worker, EEOC Finds",1
Anti-gay hecklers follow Pete Buttigieg across Iowa,1
Suspect in slaying of retired Wisconsin judge has died,0
Lesson of the Day: Decoding the Far-Right Symbols at the Capitol Riot,1
How the women in my family taught me to fight injustice,0
Trump&s revenge tour over Michigan Republican&s impeachment vote endangers a GOP House seat,1
"Donald Trump and Benjamin Netanyahu both have big, big problems",1
"Where Hillary Clinton, Donald Trump Stand on Tech Issues",1
Trump Authorizes Sanctions for Foreign Election Meddling,1
U.S. Officials Cite Intelligence El Chapo Was Plotting Escape,0
Republican senator won&t say if Democrats have a case on impeachment,1
Killing of Iranian General Brings Iraq's Divided Shiites Closer,1
"Trump, Scrutinized Over Interaction With Ukraine, Still Calls for Biden Probe",1
FBI report: Violent crime down in U.S.,0
"Ocasio-Cortez, House progressives criticize interim coronavirus bill",1
cashing in on crypto hype finance pros lure investors wanting to buy nfts,0
Madison's Gift' vividly recounts the many accomplishments of America's fourth president,0
John Kerry declares Obama's work with Iran a success: 'The world is a safer place today',0
"On Day One, Biden Destroys Womens Sports With Anti-Science Executive Order",1
"How to 'defund' the police when violence is rising? Lansing, Michigan, struggles for answers",0
putin foe navalny faces years more in jail after new conviction,0
Buttigieg calls out Democrats for playing 'identity politics',1
philippines keeps virus curbs through jan 15 as infections rise,0
This Couple Fought The Government For Their Right To Bury Their Miscarried Son,1
God Save Texas Review: A Lone Star State of Mind,0
"Obama, Merkel Urge Action on Atlantic Trade Pact",0
San Diego Sheriff's Deputy Caught on Tape Tasing Run Away Teenager; Mother Apologizes for Confrontation,0
"Majority of fatal attacks on U.S. soil carried out by white supremacists, not terrorists",1
Australias Ruling Party Gains Edge in Poll After Brexit Tumult,0
Progressive group launches ad campaign urging Democrats to oppose Kavanaugh,1
Mother Gets 8 Years for Killing Children,0
Politico Attacks Animal Activism Organization Because A Trump Is Involved,1
"Jared Kushner, Paul Manafort Russia collusion testimonies sought by different Senate committees",1
What Will It Take for Democrats to Unite Behind Impeaching Trump?,1
"Suddenly, BRIC Markets Are on a Shakier Foundation",0
How &Lock Her Up!& just blew up,0
the broken state of voting as we enter the wisconsin presidential primary,1
Raffensperger fends off a 2020 election denier to win Georgias G.O.P. secretary of state primary.,1
&He lied on national television&: Trump says truckers protesting industry problems are actually honking to support him,1
"A man has been charged after police found more than 1,000 guns in his Los Angeles home",0
Whats on TV Tuesday: This Is Us and Bull,0
bloomberg view a smarter war on poverty,0
Father says he knew he&d find the 3 students dead in Chapel Hill condo,0
"After scathing Chicago police report, hope that 'this time is different'",0
University of Michigan pushes back against free speech lawsuit,1
"Actually, West Virginia isn&t dismantling its Department of Education",1
"Rush Limbaugh, voice of American conservatism, dead at 70",0
Ottawa: The City of Makers,0
"With Eye on Growth, Imagine Entertainment Seeks an Investment ",0
Mitch McConnell blasts Democrats policing overhaul package,1
"If Greece Leaves, We All Lose",1
Iraq Picks New President to Confront Militant Threat,0
"Trump will directly address black voters, top aide says",1
Two Republicans Provide Different Views on Trumps Appeal,1
Obama to reveal Islamic State strategy in prime-time address,0
January 6 committee considers whether to seek Trump White House call logs as investigators eye next steps,1
The NFL is penalizing teams and coaches for violating Covid-19 protocols,0
Caramoor Invites the Birds to Take Part in a Songfest,0
Chinese Dissidents Trial to Begin,1
Getting rid of Paul Ryan would be a very bad idea for Republicans,1
It's Not Just Trump. California Labor Unions Are Trying To Reverse the Outcome of an Election Too.,1
Pfizer to seek Covid-19 vaccine approval 'within days' as trial shows 95 percent efficacy,0
Scott Brown Wins GOP Primary for Senate in N.H.,0
On the Trail: Week of Sept. 4,0
Michigan Board Approves Petition to Recall Gov. Rick Snyder,0
Grand'ther Baldwin's Thanksgiving,0
Mitch McConnell&s dilemma,1
A Brooklyn Original,0
"Out of Power Almost 7 Years, Blair Is Still Haunted by a Legacy of War",0
What Big Pharma Fears Most: A Trump Alliance With Democrats to Cut Drug Prices,0
WILLIAMS: A time when our ally Israel most needs our support,0
Donald Trump denies a Russia allegation that no one made,1
"Trump, Calling Mattis a Democrat, Opens Door to His Exit",1
Donald Trumps Business Decisions in 80s Nearly Led Him to Ruin,1
Here&s the 1 thing the Mueller report proves beyond a shadow of a doubt,0
"But Mom, Video Games Are My Job",0
Protest leader Bush ousts 20-year US Rep. Clay in Missouri,1
Trump announces he will nominate deputy energy secretary to replace Rick Perry in top post,0
Is Donald Trump turning on Fox News?,1
"Republican members of Congress show love for Priebus, praise Kelly pick",0
First Read: Why Clinton's Trade Flip-Flop Is So Unbelievable,1
Latin leaders profit from illegals,1
"Trump's tariffs try to solve a problem that he has exaggerated, steel industry experts say",1
Victims of Canadas Gay Purge to Get Apology from Trudeau,0
Iran deal deadlines loom as Trump weighs sanctions,0
Jerry Falwell Jr.&s fatal miscalculation,0
SXSW under fire after removing harassment-focused panel,0
NSA phone-snooping metadata still in government hands,0
On Politics: Hyde-Smith Secures Her Mississippi Senate Seat in Win Over Espy,0
NBC News president sharply rejects Ronan Farrow's claims that company covered up Lauer allegations,0
Trump reported to have ordered lawyer to urge Sessions not to recuse himself,1
Hillary Clinton protested by Black Lives Matter,1
"Donald Trump visits Britain amid 'Baby Trump,' Brexit, Russian villainy",1
Alaska Senator Faces Hard Sell on Health Bill,0
Foreign labor limits likely to leave seasonal American businesses in the lurch — again,0
An Obamacare Do-Over,1
"Senate sergeant-at-arms says cyber threat, not another insurrection, keeps her up at night",0
Black Cop: Lies About Institutional Racism Are Making America More Violent,1
Trump's Stubbornness on the Central Park Five's Guilt a Warning to Criminal Justice Reformers,1
"Biden, Sanders Split on Policy, Unite Against Trump",1
Republicans Are Americas Problem,1
"If You Cant Get Onstage, Go Online",0
Obama to Letterman on retirement: &We could play dominoes together&,0
Cheri Bustos: Last partial government shutdown was a 'total waste',1
Photographs From the Democratic Convention,0
One family&s struggle to survive Aleppo,0
Kosovo erupts in chaos as opposition pushes more Serbian power,1
Syracuse University students renew protests following administration&s response to racist incidents,1
"Cuomo, de Blasio at odds over N.Y. response to coronavirus",0
"NYC schools will reopen in the fall, the mayor says. The governor says not so fast",0
Trump: &They are laughing their asses off in Moscow& over how US handled Russia investigations,1
"Baltimore Fiddler Disrupted by Heil Hitler, Heil Trump",1
Watch Harry Reid Say Republicans Should Follow SCOTUS Biden Rule,1
Chris Christie hopes to revive flagging campaign with tough talk on terrorism,0
Reporters who investigated Harvey Weinstein react to his conviction,0
Violence Bolsters Erdogans Plan for More Presidential Power in Turkey,1
democrats get harsh reminder of fragile grip with senator ailing,1
"Opinion: Deeper India, US ties should include cybersecurity, too ",0
"Climate Queries, Asked and Answered",0
Google Deletes 39 YouTube Channels Linked to Iranian Influence Operation,0
New York police charge man in jogger&s death,0
House Republican budgets ripped by Obama over spending limits,1
"Meadows warned Trump aide that 'things might get real, real bad' on Jan. 6",1
Some Democrats Push DNC to Hold More Debates,1
"At City Agencies, Hundreds of Harassment Claims but No Consistent Response",1
John Boehner doesn&t think Republicans stand a chance of passing health care,1
Gov. Charlie Baker of Massachusetts Says He Wont Run for Re-election,0
"With nation in turmoil, Trump stages first campaign rally in months",1
Heres The Biggest Legal Flaw In Californias Sexual Orientation Therapy Ban,1
Buffalo Wild Wings employees fired for telling black family to move to please 'regulars',1
Upbeat Official Report on Race in Britain Draws a Swift Backlash,1
Sarah Sanders says Dem lawmaker&s comments are &appalling and disgusting&,1
Republicans and Trade Wars,0
Uganda president: Homosexuals are &disgusting&,1
Algerian Army Kills Militant Leader Linked to Beheading of French Hostage,1
china s covid zero policy makes 2020 style rebound less likely,0
Rep. Marjorie Taylor Greene: Kevin McCarthy lacks support to be House speaker if GOP takes majority,0
Woman Exonerated After Serving 10 Years for Manslaughter Conviction,0
Covid Hypocrisy at the U.S. Border,0
Mitt Romney Fast Facts,0
On Politics: Warrens Out but Not Down,0
New York Today: Students in Solidarity Over Gun Violence,0
"State of the Union, Joseph Kennedy, Jimmy Kimmel: Your Wednesday Briefing",0
flint lead crisis doesn t have to mean kids face long term mental damage,0
Judge to Hold Hearing Over Alleged Juror Misconduct in Queens Jogger Case,0
Putin and Rouhani Condemn U.S. Airstrikes in Syria in Phone Call: Kremlin,0
"Loudoun County, Virginia, schools' 'Bias Reporting' form sparks outrage among parents",1
Merkel Edges Closer to Fourth Term as German Chancellor,0
Top House lawmakers ask Pompeo to reject Central American aid cuts,1
Volkswagen Faces Harsher Penalties Than a U.S. Company Might,0
Ringleader of Admissions Scandal Said Investigators Told Him to Lie,1
Republican Town Hall: CNN&s Reality Check Team inspects the claims,0
Ben Carson joins Donald Trump in threatening to leave GOP,1
The Dirty Secret of American Nuclear Arms in Korea,1
Jacinda Ardern vows to deny accused New Zealand mosque gunman notoriety,0
Kasich Cronies Are Causing Libertarian Candidates' Woes,1
11 million illegal immigrants keep health care coverage while Obama drags feet,1
"Rennie Davis, One of the Chicago Seven, Traded Activism for Inner Peace",0
Even at Starbucks? A conversation grows about hidden racial bias.,1
"Leaders Death Is Another Blow for ISIS, but Its Hardly the End",0
Cavaliers Officially Land Kevin Love,0
Trump is already shaping the 2022 Senate battle,1
"U.S. Murders Surged in 2015, F.B.I. Finds",0
Denzel Washington wants viewers to look past Macbeths race,0
"In Louisiana, Covid-19 Has Achieved What Big Oil Protesters Could Not",0
My Candid Reviews of the Worlds Wonders,0
"Republican Voters, in Focus Group, Express Rage at Career Politicians",1
Scotlands Debate: Stay Big or Go Small,0
California Leads on Justice Reform,0
Trump and Trade Adviser Disagree on What to Call Deal With China,1
Obama Previews Economic Proposals,0
The Daily: Donald Trump Jr.s Deadline,1
"Feds announce new limits on chokeholds and 'no-knock' warrants, but don't ban them",0
"After Sylvester Stallone Call, Trump Considers Full Pardon of Long-Dead Boxer",0
Bernie Sanders &deeply humiliated& Democrats lost white working-class voters,1
Clinton surrogate Rendell under fire for &ugly women& remark,1
Christie to meet with GOP leaders in South Carolina,0
How Trump can win in Afghanistan,1
Eric Schmitt Wins Missouri GOP Senate Primary as Five States Cast Ballots,0
Why the Vast Majority of Women in India Will Never Own a Smartphone,0
Sean Hannity and Other Fox Stars Face Depositions in Defamation Suit,0
Chinese Leader Draws Power Into Loyal Inner Circle,0
Yet another Tesla flaw casts doubt on &full self-driving& tech,0
&SNL& gets it right: Trump and GOP are clueless about women,1
"On the Trail of a Vicious Killer, Eagerly Licking Their Chops",0
Democrats Plan Ads in Challenge to Koch Brothers,0
Turkish Protesters Defy Governments May Day Ban,1
House Republicans Resume Efforts to Reduce Feds Power,1
Illinois Governor Vetoes Ride-Sharing Restrictions,0
Obama Urges Global Effort to Help Prevent Epidemics,0
Quotation of the Day,0
How Should We React to the Ebola Epidemic?,0
1939: Nazi Raiders Stir London,0
Political Feud Weakens Coalition in Georgia,1
Just Because a Policy Causes a Death Spiral Doesnt Mean Its Unsustainable,1
McConnell Makes Final Plea to Obama on Immigration,1
Obama Responds to Ferguson Decision,0
Obama Calls Sony Decision a Mistake,0
Obamas Budget Seeks to Loosen Austerity Reins,0
Today in Politics: Iran Showdown Brings Obama and Congress to New Low,1
Irate Democrats Denounce G.O.P on Iran Letter,1
"Intrepid in an Earthquake, but Rattled by Locking Luggage",0
Today in Politics: Menendez Indictment Could Alter Congresss Role on Iran,1
"Appealing to Union, Hillary Clinton Calls Teachers Scapegoats",1
Vendor From Brooklyn Finds Clinton T-shirts a Tough Sell,1
Talk Show Roundup: Lindsey Graham Calls Donald Trump a Threat to Republicans Moral Authority,1
"In Second Republican Debate, Donald Trumps Rivals Seek Points, Not Knockout",0
"Joe Biden Ran in the Invisible Primary, and Lost to Hillary Clinton",0
Communities Come Together to Make Homes More Affordable,0
"In Conservative Louisiana, Obama Finds Little but Love",0
Theater Listings for Jan. 29-Feb. 4,0
Obama Cleared Way for Todays Outsider Candidates,0
In the Studio With Fashions Great Hair Iconoclast,0
"Review: Krisha, a Family Drama Set Around Thanksgiving",0
Bernie Sanders Vows Fight to Convention as Hillary Clinton Wins a Primary,1
Whats on TV Sunday,0
"Democrats End Sit-In After 25 Hours, Drawing Attention to Gun Control",0
Brexit Briefing: Conservative Backbiting; Labour Civil War; Welsh Regrets?,1
Donald Trump Suggests Second Amendment People Could Act Against Hillary Clinton,1
Donald Trump Jr. Invokes Holocaust Imagery in Complaint Against Media,1
"Greece, Seeking Dose of Stability, Is Rattled by Trumps Win",0
76 Experts Urge Donald Trump to Keep Iran Deal,0
Donald Trump and the Lawsuit Presidency,1
Trump Says I Think It Was Russia That Hacked the Democrats,1
Trump Supporters Have the Most to Lose in the G.O.P. Repeal Bill,1
Republicans Withdraw Their Health Bill,0
"G.O.P., Once Unified Against Obama, Struggles for Consensus Under Trump",1
Trump Faces the Limits of American Power,1
When Apple Maps Marks Your Spot,0
Sense of Crisis Deepens as Trump Defends F.B.I. Firing,1
Democrats in Congress Urge Democrats in Albany to Return to the Party,0
On The Bachelorette for the Wrong Reasons? Whaboom.,0
Trump Lashes Out at Kathy Griffin and Democrats,1
Russia Crows Over Putins Meeting With Trump,1
Right and Left React to the Donald Trump Jr. Email Scandal,1
Quotation of the Day: Trumps Attacks Leave Sessions Out in the Cold,1
"Defying Trump, Athletes Intensify Debate on Race and Protest",1
Trumps Agenda? Not So Populist,1
"Union Chief Says Trump, Having Actively Hurt Workers, Is Losing Support",1
The Republican Tax Act Could Turn Texas Blue,1
"Divided on Strikes, Democrats and Republicans Press for Clearer Syria Strategy",1
Trump Criticizes Times Report About His Longtime Lawyer,1
Turmoil for Turkeys Trump,1
Why Trump Voters Supported Trump,0
"13 Pop, Rock and Jazz Concerts to Check Out in N.Y.C. This Weekend",0
How Russia Hacked the Democrats in 2016,1
Ohio Election Raises New Worry for Republicans,1
The Blue Wave Wasnt Enough to Overcome Republican Gerrymanders,1
Judge Blocks Disputed Keystone XL Pipeline in Setback for Trump,1
Trumps Nafta Plan Could Be Upended by Democrats House Takeover,1
"Donald Trump Fails, Again",1
An Argument for Ruining Your Horrible Life,0
Polls Show Government Shutdown Is Eroding Faith in Economy,1
Trump Taps Fed Critic Stephen Moore for Board Seat,0
What Trump Gets Wrong About Central American Aid,1
Trumps Immigration Crisis,1
Divided House Democrats Delay Budget Vote as Ideological Gap Widens,1
Pelosi Accuses Barr of Law-Breaking as Democrats War With Him Boils Over,1
Republicans Watch Fractious Democratic Debates and Like What They See,1
Biden Plans a Counterattack at Trump as Impeachment Tensions Rise,1
Theyve got to be aggressively campaigning: A leading Democrat urges Biden to stay on the trail.,1
"Democrats, Facing Critical Supreme Court Battle, Worry Feinstein Is Not Up to the Task",0
Democrats Gain in Georgia Senate Races as Presidential Race Remains Tied,0
Top Democrats Back Compromise Plan to Revive Stimulus Talks,0
Trumps Final Days of Rage and Denial,1
Trump Officials Push Ambitious Vaccine Timeline as California Locks Down,0
Wall Street Journal Editorial Urges Trump to Resign to Avoid Impeachment,1
"Trump Seeks Respite in Texas, Where G.O.P. Allies Face Pressure",1
Full Analysis of the 2021 Inauguration of President Joe Biden,0
Psaki: Trump Administration Rhetoric Contributed to Anti-Asian Threats,1
How Trump Steered Supporters Into Unwitting Donations,1
"I Know Shes Gone, but Why?: Love and Loss at a Boulder Grocery Store",0
Surging Virus Has Michigans Democratic Governor at Loggerheads With Biden,0
Biden Cant Decide What Counts as a Democracy,1
The Evictions Surprised Trailer Park Residents. The Protest Stunned Officials.,1
"Biden Sends Republicans New Infrastructure Offer, but a Gulf Remains",1
"As Wars Wind Down, Congress Revisits Presidential Powers",0
Robinhoods Guinea Pig for Upending Public Offerings: Itself,0
Democrats Stumble on Drug Prices Shows Power of Industry,1
House Democrats demand answers by Friday about the Border Patrols treatment of Haitian migrants.,0
Liberalisms Last Stand,1
Biden Struggles to Unite His Own Party Behind His Economic Agenda,1
"Art Institute of Chicago Ends a Docent Program, and Sets Off a Backlash",0
Republicans Are Once Again Heating Up the Culture Wars,1
Heres How Mexico Can Clean Up Its Dirty Energy Industry,0
"As Cuba Crushes Dissent, a Nationwide Protest Fizzles",1
Why the Fed Chair Wont Call Inflation Transitory Anymore,0
The Words Democrats Use Are Not the Real Problem,1
How a National Movement Toppled Hundreds of Confederate Symbols,1
Protesters Gather in Manhattan in Support of Roe,1
"As Battles Rage, Ukraine Rejects Macron Plea Not to Humiliate Russia",1
Republicans force the removal of a measure that would cap insulin prices at $35 for private insurers.,1
A Top Wisconsin Republican Fires the 2020 Election Investigator He Hired,1
Laws and Lists in Search Warrant Offer Clues to Trump Document Investigation,1
Sex Ed Emerges as Core Issue for N.J. Republicans as Midterms Approach,0
"Obama Doesn't View Putin as Irrational, Senior Official Says",0
President Obama Wants to Provide Border Children Legal Help,0
"Republicans Have Midterm Advantage, But It Still Doesn't Look Like a Wave",1
Putin: 'The West Wants to Hold Russia Back',1
Christie: Obama 'Should Be Ashamed of Himself' Over Cuba Policy,1
Donald Trump Claims That He's Worth $10 Billion,0
Decision 2016: Democrats Battle for Iowa's Latinos,0
Kremlin Says Hackers Attacked Putin Website,1
"Stephen Hawking Talks Killer Robots, Favorite Song in Reddit AMA",0
Trump Accuses Tough Questioner of Being a Bush Plant,1
Trump Issues Twitter Warning Shot to Cruz After Reported Critique,1
Watch Clinton's Fiery Response to Indictment Question,1
Cruz Sweeps Colorado as Trump Campaign Issues Error-Filled Ballots,1
"In Attacking Carlos Slim After Times Reports, Trump Invokes Mexico, Again",1
Bathroom Bill Looms Large in North Carolina Governor's Race,0
Trump Promotes Neutrality Opponent Ajit Pai to Lead FCC,0
Trump: I'll Push McConnell To 'Go Nuclear' If SCOTUS Vote Deadlocked,1
Lack of Job Gains Could Hamper Trump's 3 Percent Economic Growth Target,1
Trump Transgender Ban Nod to Christian Conservatives,1
Opinion: Trump's DACA Decision Is Another Wrecking Ball to Latino Support for GOP,1
Brennan: Trump Aides May Need to Talk Him Out of War,1
Obama Knocks 'Old Politics of Division' in Return to Campaign Trail,0
Lewandowski rebuffs House committee's questions in Russia probe,0
NRA's Wayne LaPierre accuses Democrats of exploiting Parkland shooting in speech,1
Tough questions await new Trump nominees as Senate gears up for hearings,0
Fringe liberal ideas move to front-burner for Democrats,0
Rand Paul asks Haspel if the CIA spied on Trump in 2016,1
Impatient Trump drives U.S. push for peace talks in Afghanistan,1
"Trump cancels military parade, blames D.C. officials for high cost",1
How SpaceX's huge 'BFR' spaceship for Mars has changed,0
Trump blasts deal to dissolve his charitable foundation,1
California Gov. Gavin Newsom seeks to counter Trump's rhetoric in El Salvador,1
"On impeachment, Warren just stole the show from her dodging Democratic rivals",1
Democrat mocks Barr with bucket of fried chicken at hearing,1
A guide to Trump's nicknames and insults about the 2020 Democratic field,1
Sen. Susan Collins is an endangered Republican. Impeachment could make her more so.,1
"Trump impeachment inquiry's secrecy, and Nancy Pelosi denying a House vote, weaken Democrats' case",1
Trump and Stephen Miller capitalize on white America's fear its racial identity is losing value,1
Trump's Iran attack distracts from impeachment — but it can still hurt him politically,1
"Trump blasts 'mini Mike Bloomberg' for ads, refusal to take part in debates",1
Democratic Colorado Senate hopeful Hickenlooper apologizes for slave comment,1
Pennsylvania Supreme Court rejects Trump campaign lawsuit over election observers in Philadelphia,1
Trump's fights with fellow Republicans have political consequences beyond 2020,1
Arizona Senate Republicans sign lease to continue vote audit,0
"Biden revokes controversial Trump orders on monuments, immigration",1
Federal judge won't block Biden administration's new eviction moratorium,0
How can we benefit from it if we're not there anymore?': Obama Center neighbors still waiting for housing protection,1
"Pennsylvania Senate race rocked by late twists, from John Fetterman's stroke to Kathy Barnette's meteoric rise",1
Obamacare Opponents Lose Lawsuit over Subsidy Rules,1
The Poor Don't Pay Taxes? They Sure Do—For Obamacare!,1
"Obamacare's Mandate Won't Be Delayed, but It Won't Really Be Enforced Either",0
Should Libertarians Support Religious Exceptions to Generally Applicable Laws?,0
Will Obamacare's Employer Mandate Ever Be Implemented?,1
"Benjamin Netanyahu Had to Tell John Kerry ""This is Not Vietnam""",1
Rand Paul Says Obama's ISIS Plan Definitely Unconstitutional,1
Are Libertarians Spoiling the Midterm Elections?,1
Are Democrats Starting to Regret Obamacare?,1
Republicans Rail Against Utility Regulations for the Internet,1
Why Won't Anyone Challenge Hillary?,1
Why Is Steve Wynn Trying to Gut Nevada's Anti-SLAPP Law?,1
Of Course Democrats Deserve the Blame for What's Happening in Baltimore,1
"Maryland Governor Vetoes Asset Forfeiture Reform, Marijuana Decriminalization Bills",0
Professional-client speech and the First Amendment,0
Obama Insists 'We Have to Do Something' About Mass Shootings but Can't Say What or Why It Would Work,1
"Rand Paul, Justin Amash Trash the GOP Majority's Debt-Ridden Budget Plans",1
Is Trump's #MuslimBan a Muslim Ban?,1
Comey's Dismissal Shows Trump Is Really Bad at Cover-Ups,1
