title,label
Donald Trump may be rewriting rules for party coalitions,1
Kids Are More At Risk Of Dying From Seasonal Flu But The CDC Says They Should Get The COVID Jab Anyway,0
Hillary Clinton&s Golden State dash for cash,0
"On Taxes, Dont Forget the Deficit",0
Merkel Condemns Russian Airstrikes in Syria,0
U.S. Loses Appeal Seeking to Block AT&T-Time Warner Merger,0
Times Reporters Analyze Hillary Clintons Presidential Announcement Video,0
McConnell slams Dems for engaging in 'coordinated campaign' to smear Senate filibuster as 'racist',1
Flake to GOP: We must say Trump&s behavior is &not right&,1
"Elizabeth Zaino, James Reuter",0
Hank Aaron remembered for shattering records and racial barriers,0
Something of Themselves Review: Sojourns in a Battleground,0
"Cuomo, Democrats, and the politics of personal conduct",0
"Congress Will Not Derail Nuclear Talks, Iran Says",0
&Jeopardy! The Greatest of All Time& aims to crown a champ of the champs,0
David Denbys Lit Up,0
No Charges in Minneapolis Police Shooting,0
"Suspected Electrical Blast at Mall in Perth, Australia Kills Two",0
Bob Dylan and his uneasy Nobel predecessors,0
Trump Education Official to Resign and Call for Mass Student-Loan Forgiveness,0
rivers malone latest nba coaches to enter protocols,0
Why Wisconsin will be the next front in the Big Lie fight,1
Indias Newfound Confidence,0
Trump Adviser Kellyanne Conway Ignores Congressional Subpoena,1
Trumps Ruining Tariffs for Everybody,1
djokovic makes more history with 1st round win at wimbledon,0
A Path to Democratic Compromise in Hong Kong,0
Goldman Takes Stake in Under Armour CEOs Baltimore Development,0
"This year, top colleges are forgoing politicians as commencement speakers",0
Exhibitions Where Moral Force Trumps Market Forces,0
Hillary Clinton email scandal may be part of Democratic debate,1
CHiPs' actor Larry Wilcox discusses the 1970s show and his new technology,0
He Was More Than His Madness,0
Ted Cruz Wont Be Denied,0
Chris Christie Says Jared Kushners Father Committed a Loathsome Crime,1
Special-Education Rule Issued by Obama Administration Is Delayed,0
IMF says trade conflicts could make a sluggish global economy even worse,0
"Justice Department Questions Validity of SEC Judges | Trump Picks Goodfriend for Fed, Workman for FSOC | Hayashis Take: CFPB Mortgage Rules Seen as Target",1
russia vetoes un resolution as china abstains ukraine update,0
Samsung heir Jay Y. Lee indicted over controversial merger in South Korea,0
Lady Gaga 'Finally' Gets Her Driver's License at 30!,0
TikTok Wants to Stay Politics-Free. That Could Be Tough in 2020.,1
Xi&s Olympic guest list heavy on strongmen and autocrats,1
Uvalde schools police chief Pete Arredondo resigns from City Council seat,0
State Houses of Georgia and Tennessee pass heartbeat bills,0
"Trump deputy national security pick scrubs her website, Twitter, and Facebook from the Internet",1
Some Cities Turn to Decriminalizing Drugs as Overdoses Climb,0
"Guerrilla Girls, Going and Going …",0
When 'truth isn't truth:' How Rudy Giuliani and Trump are exploiting the flexibility of language,1
Kerry Criticizes Republican Letter to Iranian Leaders on Nuclear Talks,1
"Review: Darkness Rising, a Bland Haunted-House Salad",0
There's Something for Everyone To Hate in Sen. Martha McSally's Plan for Federally Subsidized Vacations,1
Poll: Less than half of Americans say they'll get a coronavirus vaccine,0
Biden to Join Hillary Clinton on Campaign Trail,0
"Corrections: Aug. 20, 2022",0
Egyptian Leader Gets Challenger in Election Critics Call a Farce,1
Redskins diehard fans take team devotion to their graves,0
"Cyclone Chapala, Gathering Strength, Heads Toward Oman and Yemen",0
Group Backing Donald Trump Hires Ex-Aides to Rudy Giuliani and George Pataki,0
Canada Wants Refugees to Go West,0
"Biden putting together post-election transition team, talks Cabinet makeup",0
Iran Ready to Send Arms to Iraq to 'Fight Against Terrorism',0
Ted Cruz Vows to Continue Campaign If He Loses Indiana,1
Donald Trump issues veto -- second of presidency -- on bill to end U.S. involvement in Yemen war,1
YouTube Clashes Over Licensing Deals,0
Iran Cant Whitewash Its Record of Terror,1
How Much Watching Time Do You Have This Weekend?,0
Trumps Message on Virus Draws Scrutiny,0
Jon Voight slams 'angered left-wingers' in video defending Trump,1
Yankee Trade Bait: A Thunderous Bat in Trenton,0
Biden campaign will not pull advertising despite widening boycott against Facebook,1
Banco Santander Appoints Chief of Its British Business,0
French Left Picks Hamon as Presidential Candidate,0
Bayern Munich Beats Lyon and Will Face P.S.G. in Champions League Final,0
Carson McCullers at 100,0
1972 | Pressmen Balk at an Impeachment Ad in The Times,0
First Read's Morning Clips: Close races in Florida and Missouri,0
Fact-checking Donald Trump&s Fox News interview,0
Centaur Media Mulls Divestments; Sees Adjusted Operating Profit Below Views,0
Times Minute | Obamas Overseas Trip,0
How Much Do You Know About Paraguay?,0
Muhammad Ali: Inside his final hours,0
Union Official Resigns Over Handling of Plácido Domingo Inquiry,0
"After high drama, Southern Baptists denounce the &Alt-Right&",0
"Gertrude Mokotoff, Ex-Mayor and a Bride at 98, Is Dead at 100",0
Trump campaign: Matt Bevin is an 'outlier',0
"Ursula K. Le Guin, best-selling science fiction author, dies",0
Donald Trump just called Stormy Daniels &horseface.& Don&t act surprised.,1
"De Blasio, Covid-19 and Some Orthodox Jews",0
Top prosecutor on Mueller&s team expected to leave Justice Dept. soon,0
Madeleine Albright says she 'owes an apology' to Mitt Romney: 'We underestimated' Russia as a foe,1
"Corrections: Oct. 10, 2020",0
"For vulnerable voters, Trump's diagnosis may weaken his case for re-election",1
Sit-In Leaders Are Charged in Hong Kong,0
china comes to grips with opioids,0
"Obama, Shinzo Abe to talk trade, defense during visit to U.S.",0
How the Trump Era Is Molding the Next Generation of Voters,0
ryanair fined over hungary tax its ceo called beyond stupid,0
Obama Says World Seems to Be 'Spinning' Out of Control,1
What Kind of Tourist Are You?,0
Illinois Spent the Last Decade Losing Population and Learning Nothing,0
"The 10-Point: Gerard Baker on Syngenta, the Egypt Plane Crash, the Republican Primaries and More.",0
Stormy Daniels sues Trump over alleged affair and &hush& agreement,1
Will Attacking Donald Trump keep Rand Paul in the 2016 Mix?,1
"Trump's lawyers reject accusations of inciting Capitol riot, call impeachment unconstitutional",1
Donald Trump 'public charge' immigration rule tossed by federal judge,1
"For U.S. Earnings Season, Bar Is Low and Hopes Are High",0
8 Ways Pope Francis Is Changing the Direction of the Catholic Church,0
MPS Chief Won't Quit at Next Board Meeting,0
Trump Wants a Referendum on the Economy—and Sanders May Oblige,0
European Court of Justice rules Britain can unilaterally cancel Brexit,0
Duke Porn Star Belle Knox Wishes the GOP Would Get More Libertarian,0
Trump Pays $2 Million to 8 Charities for Misuse of Foundation,1
Kevin Durant Destroyed the Idea That He Should Just Fit In,0
"Trump and Putin Pledge Cooperation on Global Affairs, But Offer Few Details",0
"A 24-year-old wanted billboards with his face on them, and they could lead to love",0
Calls grow for Trump&s removal after Capitol riot,1
"For Jrue Holiday, Its a Good Game When His Wife Says So",0
Clinton Campaign Tries to Reassure Supporters,0
House Democrats reveal new impeachment resolution,1
Premier League: Liverpool defeats Manchester United,0
Kirk Cameron leads 'Christmas Caroling Peaceful Protests' against California stay-at-home orders,0
Big City Book Club: 4 3 2 1 by Paul Auster,0
Texas Governor Signs Divisive Voting Bill Into Law,0
"No Evidence Doctors Can Stop Young Patients From Using Drugs, Say Researchers",0
Gov. Hogan's handpicked successor warns GOP voters the Trump-backed candidate will lose to Dems,1
"Instagram hits 500 million active users, but not without controversy",0
Democracy in America: Counting the Votes,0
Chris Cuomo 'Fredo' racism claims rejected by black activists,1
The September 30 Deadline For Obamacare Repeal Is Fake News,1
Deadline Today: Intern at Reason This Fall!,0
Whats on TV Friday: Vanity Fair and Life Itself,0
Are You a Los Angeles Public School Teacher? We Want to Hear From You,0
"Im An Immigrant, Minority Woman Going Republican Over Democrats Treatment Of Kavanaugh",1
Calm before storm? How Senate could change after Barrett confirmation.,1
business activity deteriorates globally as recession fears rise,0
FIDE's (latest) updated chess title match rules -- there's a lot to like,0
A survey finds that Americans think the best president in their lifetime was Obama,0
Donald Trump signs order supporting historically black colleges,0
Elizabeth Warren targets opioid crisis in latest policy rollout,1
What are snow squalls and why they&re more dangerous than blizzards,0
"Senate Sends Military Bill to Trumps Desk, Spurning His Veto Threat",1
Judge Upholds Order for Trump Administration to Restore DACA,1
Does human rights champion France live up to its ideals at home?,0
"Kamala Harris, Pete Buttigieg, other Democratic candidates release plans to fight climate change",0
"A Summery, Colorful Collection of Landscapes",0
US intelligence officials warn China is &working hard& to be able to take over Taiwan militarily,1
Georgia Republicans Aim To Restrict Voting by Mail,1
"As US attacks Islamic State near Baghdad, the fight hits one US family at home",1
"Austin Police Botch Nearly 1,400 DNA Cases",0
"Boy, 13, attacked by shark off Southern California coast",0
Gay Activists Attack Homophobic Black Ministers MLK Day Sermon,1
Criminal Justice Advances,0
Sudan&s leader has avoided major public unrest for years -- but that could be about to change,1
"Kamala Harris: &Yes,& President Trump is racist",1
Hillary the Shaky Favorite,1
New York City mayor launches commission to address systemic racism,0
Emotional debate erupts over anti-lynching legislation as Cory Booker and Kamala Harris speak out against Rand Paul amendment,1
Climate Change Brought a Lobster Boom. Now It Could Cause a Bust.,0
How the US is trying to help Ukraine without triggering a wider war with Russia,0
"Donald Trump, Federal Reserve, Dutch Elections: Your Thursday Briefing",0
Syria Peace Talks Get Under Way,0
Texas Eyes 'Women's Privacy Act' That Critics Say Targets Transgender People,1
Germany considers fines for Facebook to stop spread of 'fake news',0
"If Liberals Hate Him, Then Trump Must Be Doing Something Right",1
"John McCain on Boehner's Resignation, Kim Davis, Drug Legalization, Planned Parenthood",0
Wisconsin Voters Sue Democrat Cities Over Illegal Drop Boxes In 2020 Election,1
"Trump signs VA reform bill, making good on a campaign promise",0
Why Joe Biden Cant Restore Unity,1
Federal Judge Bars Navy From Punishing Unvaxxed SEALs Seeking Religious Exemptions,0
"Inflation soars to highest point in 40 years as Biden, Democrats sink lower in polls",1
Gaza Truce Ends,0
"D.C. Attorney General Ignores Court Order, Refuses Gun Permits",1
Ocasio-Cortez gets Republican challenger for congressional seat,0
"With Both Parties in Turmoil, Britain Weighs a General Election",0
"Facebook Better Prepared to Fight Election Interference, Mark Zuckerberg Says",1
How The Lefts Push For Equity Is Destroying Equality,1
"President Trump&s remarkable, misinformation-filled midterms media blitz",1
"House Republicans bring bill to reauthorize Keystone XL pipeline, cut Biden out of process",1
"John Yarmuth, House Democrats surrender on 2020 budget resolution",1
Big Talk But No Votes From GOP on ISIS Fight,1
Nations Capital Pays Respects to Civil-Rights Icon Rep. John Lewis,0
"Mother charged with murder, torture in death of 10-year-old son",0
1916: Food Grows Scarce in Bulgaria,0
"Fannie, Freddie Regulator Defends Actions",0
Black appraisers call out industry's racial bias and need for systemic change,1
Democrats demand transcript of Trump's phone call with Ukrainian President,1
miscalculations errors blamed for massive new mexico blaze,0
Democrats pick Milwaukee for 2020 national convention site,0
What Trumps Foreign Policy Gets Right,0
Trump Gives Mattis an Inauspicious Label: Democrat,1
Why Uber Wont Call the Police,0
Lawmakers on Both Sides Call for Antitrust Action Against Big Tech,0
"Hamas calls for holiday cease-fire, hours after rejecting similar truce",0
"With Hope gone, Trump could soon be left home alone",1
"Experts: Secure the Internet of Things, but don't let privacy 'hysteria' limit benefits",0
New Hampshire Secretary of State Faces Job Threat,1
The Witch Continues to Enchant as a Feminist Symbol,1
Lebanese official: We want &the truth& from Prime Minister Hariri,1
"Readers Respond: Alone Again, Naturally",0
The fallacy of Republicans& it&s-time-to-move-on-from-2020 argument,1
Trump pushes to delay defamation suit by E. Jean Carroll,1
Pro-life groups urge Congress to spurn push for abortion clinics on federal land,1
"GM bailout cost taxpayers $11.2 billion, report says",0
EDITORIAL: Democrats falling on an identity-politics sword,1
Accusations by Government Reviewer of Bolton Book Play Little Role in Hearing,1
Ohio Governor Weighs 2016 Run,0
How scientists accidentally discovered 50-million-year-old underwater volcanoes,0
Zimbabwe summons US ambassador over national security adviser&s Floyd protests comments,1
Mike Rizzo shows discipline in pulling away from trade for Chris Sale,0
Alabama Apologizes to India for Police Assault on Indian Visitor,0
Jeb Bush: &Donald Trump is a jerk&,1
GOP Senators to Contest Some Electoral College Results,0
Trumps Blames Clinton Over Tax Code,1
Fund-Raising Surged for Republicans Who Sought to Overturn the Election,1
"Tropical storm Megi hits Philippines, leaving at least 25 dead",0
FIFA Is Warned That Banning Top Games in U.S. May Breach Antitrust Laws,0
Trump says anti-Kavanaugh protesters sharing stories of sex assault are 'paid professionals',1
Senators push school safety bill ahead of expected House vote,0
"Trumps Harvest Box Isnt Viable in SNAP Overhaul, Officials Say",1
Trump Said to Favor Leaving a Few Hundred Troops in Eastern Syria,1
Palestinian civilians trapped in Gaza amid intensifying Israeli bombing,0
An associate of the drug cartel once run by El Chapo has been charged with participating in an international drug conspiracy,0
"Police release names of dead, injured from Oklahoma State tragedy -- many children",0
Inside the Beltway: Trump is 'odds-on favorite to win re-election' says political analyst,0
Biden weighs history-making picks for defense secretary,0
kansas governor brownbacks lab for steep tax and budget cuts,0
Senator with a Shovel: Cory Booker Is Still Digging People Out,0
"With Hacking, the United States Needs to Stop Playing the Victim",1
"Oregon releases police misconduct records, others to follow suit",0
How Republicans& star impeachment witness turned on them,1
Bipartisan support for criminal justice reform builds in Senate,1
GOP Sen. Bill Cassidy: Latest health care plan doesn&t fulfill Trump&s promises,1
Sparking Entrepreneurship in Teens,0
gop senator cramer sidelined after injury in yard work mishap,0
Trumps Crazy Choices for the Courts,1
Republicans on Verge of Power in New York State Senate,1
Democrats to States: No New Tax Cuts,0
"GOP-led committee backs renaming bases that honor Confederates, setting up clash with Trump",1
Todays Logistics Report: Toyotas Tariff Shift; Grocerys Delivery Toll; Squashing Mexican Tomatoes,0
U.S. pulls top Navy official at Gitmo; inappropriate relationship alleged,1
An Unfunny Thing Happened on the Way to 2021,0
Oklahoma state board affirms decision to downgrade accreditation for 2 school districts over violating law on race and gender teaching,0
One Mans Crisis of the Soul (Its a Comedy),0
L.A. officers who caused giant blast with fireworks likely to have made 'significant miscalculation',0
"With Trump Visit, Protest May Follow Opening of Civil Rights Museum",1
Kyrsten Sinema calls for restoring Senate's 60-vote threshold to pass anything,0
"Trump Demands CNN Retract a Poll, as OANN Teases a Rosier View",1
What do 'social inclusion' rankings tell us about the child migrant crisis?,0
"Scores Dead in Bangladesh Fire: This Isnt About Poverty, Its About Greed",1
Sinclair Deal With Tribune Hits Complications in Washington,0
The vigilance needed after Dallas,0
Supreme Court to Consider State-Secrets Case Involving FBI Surveillance,0
Petes Dragon Review: CGI That Can Fly,0
The Supreme Court gave Trump leeway on executive actions. Biden wants the same treatment,1
Sotheby's Board Members Said Loeb Right on Many Criticisms,0
Johnson & Johnson to Sell Cordis Unit for Nearly $2 Billion,0
Alexandria Ocasio-Cortez's socialism makes her enemy of America,1
Police say hoax 911 call led to fatal shooting of unarmed Kansas man,0
on the ground at venezuela s massive anti government protests,1
us black workers are seeing above average wage gains cea finds,0
Roman Catholic Church of Philippines Criticizes Dutertes Bloody Drug War,0
Border Surge Complicates GOP Pitch to Hispanics,1
Pentagon Sizes Up Email Hack of Its Brass,0
peru prime minister torres quits and triggers cabinet reshuffle,1
italy swings hard right putin grabs land the political week in photos,1
"In China, Civic Groups Freedom, and Followers, Are Vanishing",0
Remarks by George W. Bush at McCain Memorial,0
Andrew Jacksons First Presidential Defeat Fueled His Later Triumph And Created A New Political Party,0
"Confederate statues in New Orleans may be vandalized if not removed, city attorney tells court",0
Koalas are likely dying by the hundreds as Australian wildfires tear across their habitat,0
What Will Emails Clinton Thought She Destroyed Reveal?,1
"Conservatives Agree Big Tech Is A Problem, But Split On The Right Solution",1
Loewe: Fall 2019,0
Doesnt President Obama Know That $10.10 an Hour Is Not Enough?,1
How Wendy&s is responding to criticism after a franchisee donated to Trump&s reelection campaign,1
Lets Talk About the Economic Roots of White Supremacy,1
"You May Like Obamacare, But Dont Forget About The People It Has Hurt",1
sunak defends change of heart on tax cut in uk leadership race,0
French Court Dismisses Hate Speech Case Against Dylan,1
"Donald Trump on removal of Confederate monuments: 'Who's next, Washington, Jefferson?'",1
Consumer Bureau Nominee Could Face Bumpy Ride Over Lack of Experience,1
The Kaiser of Atlantis and Mezzo Extravaganza Reviews: Outdoor Opera Resonates,0
The Economy Under Trump: Plan for the Worst,1
Is economic inequality part of Gods design?,0
Palestinian Newspaper Accused of Running Muhammad Cartoon,0
Myanmar security forces intensify crackdown on anti-coup protesters,1
Mexico&s next president is a Trump critic promising new US-Mexico relations,1
Dominion Voting wins key decision in lawsuit against Fox News,0
Six Takeaways From Senators Questions to Impeachment Lawyers,0
Kenosha Doesn't Have To Be a Vision of America's Future,0
"EDITORIAL: Obama's foreign policy is contradictory, slow",1
Feds are still trying to stop the &climate kids& lawsuit,0
Graham reluctant to back McConnell as GOP Senate leader without Trump connection,1
"So, Did Bad Things Happen With the Election in Philadelphia?",0
Trump&s silence after attack on Muslims speaks volumes,1
Donald Trump hits all the right notes in border speech,0
Comey Letter on Clinton Email Is Subject of Justice Dept. Inquiry,0
Hexagon Composites to Acquire Remaining 50% Stake in Agility Fuel Solutions,0
Acting spy chief refuses to comply with House intel panel subpoena,1
D.C. schools dropping out of anti-bullying program,0
"Beyoncé gives $100,000 to 4 historically black colleges after Coachella performance",0
"Black, Latino queer students say they are on edge in the wake of 'Don't Say Gay' bill",1
Viktor Orbán's Reelection Shows Mere Democracy Is Not Enough,0
Bill Gertz Says National Defense Is Woefully Inadequate,1
Republican Rep. Dan Crenshaw heckled for saying the 2020 election wasn't stolen,1
Should We Fear Post-Pandemic Inflation?,0
"Trump Unveils High-Powered and Well-Heeled Business Council, and Invites Filipino Strongman to White House",0
These are the Republicans who are against Trump and for impeachment,1
Pastors Say Black Churches Need to Review Security,0
President Hollande comes on strong with criticism of Trump,1
Grassley hasn&t decided whether to give Obama&s Supreme Court pick a hearing,0
Clinton Leads Trump by 4 Points in Latest Poll,0
German Stocks Show Strength in Europes Battered Market,0
A Victory for the Steelers Is a Victory for N.F.L. Parity,0
"Jack Van Impe, End Times Preacher on TV, Is Dead at 88",0
Daily Report: Secret to Shut Down,0
Stormy Danielss Full Disclosure Book Will Likely Rattle White House,1
EDITORIAL: Beware of politically correct Halloween costumes,1
These transgender soldiers are still allowed to serve. They want to prove their detractors wrong,0
GOP throws up impeachment shield around Trump,1
"Trump to DOJ: Don&t let Debbie Wasserman Schultz, aide, &off the hook&",1
inside decades of black architectural resistance,0
U.N. Human Rights Chief Blasts Demagogues of Western Nations,1
Stand Up for Beijings Hostages,1
Inside the Beltway: Multiple polls percolate in Trump's favor,0
Michigan Governor Wont Run for President,0
"With final states called, Biden's projected Electoral College victory matches Trump's in 2016",0
Megyn Kelly says corporate news 'outrage' model kept on Trump life support: 'They need him',1
The President cannot comprehend true patriotism,1
"ICANN, copyright infringement, and ""the public interest""",0
us asian allies say path to talks with north korea still open,0
How Impeachment Consumed a Governors Race,1
Britains Dirty Election,1
Donald Trump &felt bad& for bashing Jeb Bush,1
Trumps Trade War Is Digging The Coal Industry Into A Hole,1
A Pivotal Brexit Vote Gives Boris Johnson a Shot at Redemption,0
I am a Trump supporter: Voters speak out,0
Progressive group pushes Democrats to tie Israel aid to settlement issue,1
Moonshot Metaphor on Cancer Is a Failure to Communicate,0
America now in 'constant crisis',1
Pfizer Stock Doesnt Need a Booster Shot,0
"Trumps Trial Team to Include Starr, Dershowitz",0
Sen. Paul Threatens Fed Vote Delay,1
"Islamist group ISIS claims deadly Lebanon blast, promises more violence",1
"Walter Scott shooting: Mistrial for Michael Slager, former S.C. police officer",0
Democrats Best Bet to Retake the House? Follow the Sun,0
"Former Maryland police officer found dead with children believed to be the daughters he allegedly abducted, police say",0
FAA numbers confirm it -- 2021 was terrible for bad behavior in the skies,0
Moulton dings Trump's D-Day speech on 'unbreakable bonds': 'This president has failed to do that',1
Theresa May: Trump Was 'Being a Gentleman' by Holding My Hand,0
Ciaran McKeown Dies at 76; Sought Peace in Northern Ireland,0
Australias Turnbull Calls Reform Summit,0
Eurozone Businesses More Upbeat Despite Greek Deadlock,0
Cruise ship rescues 24 people from sinking boat off the coast of Florida,0
"A Race Among Equals, and Also Dogs",0
Why Im Grateful God Didnt Answer My Prayer,0
Donald Trump accuses Anthony Scaramucci of abusing staff: 'He was a mental wreck',1
McConnell: Next Steps on Obamacare are 'Somewhat Murky',1
New Yorks Fleet Week Kicks Off,0
Feds Harker Says October Rate Cut Wasnt Needed,0
Tying Up the First Amendment With Red Tape,0
Grand jury declines charges against Buffalo officers in injury of elderly protester,1
"Rod Rosenstein, a Tough-on-Crime Conservative Thrust Into a Political Maelstrom",1
ISIS Deputy Leader Abu Alaa al-Afri Killed by Airstrike: Iraq Military,1
Anonymous hacktivists labeled 'idiots' by Islamic State supporters after vowing cyberwar,1
O'Reilly clashes with Obama,1
Trumps 90-Day Challenge: Settle on a Message and Erase Bidens Lead,0
Canada Suspect in Fatal Knife Attacks Dies After Arrest,0
Chinese Police Detain Activist Who Runs Website,0
The Michael Flynn I Knew In Iraq Was A Brilliant Patriot,0
Anxiety over Stormy Daniels pervasive inside the White House,1
"Jon Tester, Montana Democrat, backs interior pick Republican Ryan Zinke, eliminates opponent in Sena",1
Republican Debate Takeaways: Saturday Night Fighting,0
Is the Coronavirus an Epidemic or a Pandemic? It Depends on Whos Talking,0
Poll finds 40% of Republicans view Jan. 6 as a very violent attack,1
Suspected Al-Shabaab Militant Arrested in Frankfurt,0
Trump spends first night at Walter Reed for Covid-19 treatment,0
Trump&s experience as a reality TV star finally came in handy,0
"Schumer Lobbies Democrats to Back Manchin Climate, Tax and Healthcare Deal",0
Why Isnt Trump Riding High?,1
"With Philadelphia Shortfall, Schools Face Renewed Cuts ",0
Former Interns Say SpaceX Ignored Sexual Harassment,0
Violinist Apologizes for Culturally Insensitive Remarks About Asians,0
Donald Trump Calls for Ban on Muslim Entry Into U.S.,1
Trumps White House at the End of the Line,1
Michelle Obama and Melinda Gates: We can&t ignore adolescent girls in Covid-19 response,0
"Donald Trump blames Democrats, and some Republicans, for ditching payroll tax cut",1
&Protests& or &riots?& It makes a BIG difference.,1
Three Ways to Quit a Campaign,0
Russia Wanted Trump to Win. And It Wanted to Get Caught.,1
The Global Political Pandemic,1
"Orrin Hatch, Longest-Serving Republican U.S. Senator, Dies at 88",0
Cardona is pushing for billions more for schools. But will federal control come with it?,1
"CBS News gets first-hand experience with coronavirus, disrupting its New York operations",0
India Still Awaits Apology From Britain for Massacre in Amritsar 100 Years Ago,0
What lures Americans to Syria fight,1
"Weinstein, Hefner and the Poor Excuse That Explains a Lot",0
Fallout for the S.E.C. and the Justice Dept. From the Insider Trading Ruling,0
"Palestinian party posts, pulls image of skulls with Jewish stars",1
A Center-Right Party Decisively Wins Quebec Vote,0
