topic	tweet_id	tweet_url	tweet_text	class_label
COVID-19	1252610275645284352	http://twitter.com/user/status/1252610275645284352	Може сега да сме дистанцирани. Но няма да позволим на разстоянието да ни попречи да живеем заедно. Оставаме дистанцирани, оставаме заедно. Ще преминем през това заедно. Samsung #StayApartStayTogether #GetThroughThisTogether Научи повече: https://t.co/ESwdeImAlX https://t.co/i0w9ptNTwa	0
COVID-19	1287618554792116224	http://twitter.com/user/status/1287618554792116224	Хоспитализирани са четирима – по двама в областната болница и в МБАЛ – Мадан. Петият случай е лекар от общинската болница в Девин, който има леки оплаквания и е на домашно лечение https://t.co/SyvgOK1THD	0
COVID-19	1294989018673942529	http://twitter.com/user/status/1294989018673942529	Над 21 милиона са заразените с COVID-19 по света https://t.co/92asAZjqi3	1
COVID-19	1299368208399577090	http://twitter.com/user/status/1299368208399577090	72 млн. лева са изплатени на микро- и малки предприятия за преодоляване на икономическите последствия от COVID-19 https://t.co/bTSicrZz6y	0
COVID-19	1257228057330569216	http://twitter.com/user/status/1257228057330569216	Извънредното положение не е оправдание за компромис с медицинската наука https://t.co/BtSvKQbwpY чрез @centerprh	0
COVID-19	1265996258864488448	http://twitter.com/user/status/1265996258864488448	Британският вестник "Телеграф" разказва как #Гърция е действала своевременно и решително в борбата срещу коронавируса. // Πως η Ελλάδα κινήθηκε έγκαιρα και αποφασιστικά στην αντιμετώπιση του #COVID19 . Via: @Telegraph https://t.co/sF0fB1ahPj	0
COVID-19	1252523982139637761	http://twitter.com/user/status/1252523982139637761	При излизането си от болницата човекът е споделил, че се чувства отлично и е изразил благодарност към медицинския екип заположените за него грижи https://t.co/oFxRxJVNNJ	0
COVID-19	1267776012282146816	http://twitter.com/user/status/1267776012282146816	на #рсм му се дигна #кривата. 🦠 #sarscov2 #covid19 @zdravstvomk @koronavirusmk @vladamk https://t.co/f54J8Gynkh	0
COVID-19	1290911704960978945	http://twitter.com/user/status/1290911704960978945	Несебърлии излязоха на протест срещу избора на база за карантиниране на заразени с Covid-19 туристи в крайморското градче. https://t.co/vvqE4jD6Dv	0
COVID-19	1280739280562925568	http://twitter.com/user/status/1280739280562925568	Днес Ви предлагаме: Елегантен сет от две части: черна изчистена рокля без ръкав и феерична туника от шифон (черен) 39,90 лв. https://t.co/rmHa2muit2 #максимода #maximoda #maxiclothes #clothes #fashion #moda #style #womanstyle #beautiful #bulgaria #lookoftheday #design #shopping https://t.co/k4WWZEpyxV	0
COVID-19	1294173517198569473	http://twitter.com/user/status/1294173517198569473	Испански регион забрани тютюнопушенето заради Covid-19 https://t.co/169SgL6GpV	0
COVID-19	1270589542119112704	http://twitter.com/user/status/1270589542119112704	79 са новите заразени с #коронавирус у нас, починали са трима души #covid19България #новиниБългария https://t.co/ZYKbiJDgl5	0
COVID-19	1247584267246260224	http://twitter.com/user/status/1247584267246260224	@ipavel При нас има болни от COVID-19. Някои може да прекарат заразата дори без симптоми,други развиват пневмонии,а трети за съжаление загиват.Факт.	0
COVID-19	1273481904403165184	http://twitter.com/user/status/1273481904403165184	5 нови с COVID-19 в кв. “Изток” в Кюстендил, от днес маските са задължителни в града https://t.co/1VkrymLM55	0
COVID-19	1293500124358991878	http://twitter.com/user/status/1293500124358991878	Вдигнете ръцете ако ви е писнало от Корона! #coronavirus #coronavirusbg #стигавече https://t.co/VLvL39ajON	0
COVID-19	1248159451271569410	http://twitter.com/user/status/1248159451271569410	Надявам се това да вдъхнови и другите да направят нещо подобно. Животът е твърде кратък, така че нека направим всичко, което можем днес, за да помогнем на хората сега. А как #ArtificialInteligence помага за борбата с COVID-19 ➡️ https://t.co/ADAC6FIf87 #movebg #editbg #startup https://t.co/l3PHL1bqTR	0
COVID-19	1279824732741869571	http://twitter.com/user/status/1279824732741869571	НДК съкращава 30% от персонала си заради огромни загуби след COVID-19 | Банкеръ https://t.co/T0qpGtecZI	0
COVID-19	1254328328359759872	http://twitter.com/user/status/1254328328359759872	Сигурно протестиращите са биле от петата колона на Русия и шестата колона на Китай. https://t.co/c1sg4JB148	0
COVID-19	1262708578986713088	http://twitter.com/user/status/1262708578986713088	„Зелените” приемни ще се провеждат при спазване на социална дистанция и на всички предписани мерки срещу COVID-19. Телефонът за записване за приемните дни е 032 68 27 27 https://t.co/bA4DuRWNpZ	0
COVID-19	1280121811636805636	http://twitter.com/user/status/1280121811636805636	Напастта „бетономорие“ е сравнима с Covid и корупцията https://t.co/qdQPade3f9	0
COVID-19	1243433147112591360	http://twitter.com/user/status/1243433147112591360	Починалата от Covid-19 в САЩ българка отказвала да отиде в болница https://t.co/fnUvqqm4Yy Mediapoolbg https://t.co/yxXV0eXvRe	0
COVID-19	1288890293358669826	http://twitter.com/user/status/1288890293358669826	Даамм... Удвоява се... Въпреки всичките протести, блокажи, агитки и сценки, палатки, чадъри и шнорхели, резиденти с напъни и всякакви шменти-капели... https://t.co/ASKCzr0Z7m	0
COVID-19	1252464172421521408	http://twitter.com/user/status/1252464172421521408	51 нови случая на Covid-19 са регистрирани през последното денонощие у нас. 5 от тях са в #Бургас https://t.co/qphR7oMjc6	0
COVID-19	1263517135810281472	http://twitter.com/user/status/1263517135810281472	БАБХ затвори 5 заведения-нарушители на COVID мерките https://t.co/mRkNC9CpRE	0
COVID-19	1246358133208997890	http://twitter.com/user/status/1246358133208997890	Малика както винаги кърти мивки https://t.co/TkJ6Pn3nkC	0
COVID-19	1250653392336273408	http://twitter.com/user/status/1250653392336273408	Расте броя на инфекританите с Covid-19, вече са 783-има : https://t.co/odbEXBdbGT https://t.co/crXLtNvKa3	0
COVID-19	1246024875183157248	http://twitter.com/user/status/1246024875183157248	Ако вече се чудите какво да си приготвяте за хапване, прекарвайки времето си у дома, предлагаме ви идеи за апетитни сандвичи, които ще превърнат диетичното хранене във вкусно удоволствие използвайки любимия си ВИТА хляб. #StayHomeSaveLives #StayHome https://t.co/jTeh026DLj	0
COVID-19	1273934434371174400	http://twitter.com/user/status/1273934434371174400	Случай на COVID-19 и в Министерството на отбраната https://t.co/KlKERku3Fd	0
COVID-19	1250805429581393922	http://twitter.com/user/status/1250805429581393922	Одобрен е първият пакет от мерки в подкрепа на гражданите и бизнеса във Варна: Първи пакет от мерки в подкрепа на гражданите и бизнеса в условията на COVID -19 одобри на днешното си заседание Общинският съвет във Варна. Мерките, предложени от кмета Иван… https://t.co/zPRreQGZZA	0
COVID-19	1259147536704720897	http://twitter.com/user/status/1259147536704720897	Трима с COVID-19 са настанени в Хигия, санитарка и медсестра на домашно лечение https://t.co/Ngd3wK00wX	0
COVID-19	1271775205610844161	http://twitter.com/user/status/1271775205610844161	Положителна проба за COVID-19 e дал служител на РЗИ, след работа в с. Изгрев https://t.co/zJasDPJjRp	0
COVID-19	1291703029218058240	http://twitter.com/user/status/1291703029218058240	@DidiGK @bgMamaMilf @SuzanSaamieva вчера прочетох това мнение по темата, вероятно много хора имат нужда да се откъснат от ежедневието си, особено сега https://t.co/WAuZclXQIi	0
COVID-19	1247041729104150528	http://twitter.com/user/status/1247041729104150528	(Трябва да се преоцени забраната за извършване на профилактични прегледи, включително диагностични) от Зарата - Новини - https://t.co/OqlltV36vM #новини #COVID19 #забрана #профилактика #СтойчоКацаров https://t.co/tTWfUizcmV	0
COVID-19	1253946981128470530	http://twitter.com/user/status/1253946981128470530	С 46 новоустановени с COVID-19 започва денят https://t.co/gqS9FAD6X9	0
COVID-19	1248517756439474177	http://twitter.com/user/status/1248517756439474177	@bunnyBlane Има и такива, които вярват че 5G причинява Covid-19	0
COVID-19	1265238797354242048	http://twitter.com/user/status/1265238797354242048	Жена от Троян е заразена с Covid-19 в “Пирогов”. Настанена е в софийска болница https://t.co/923uXYpymb	0
COVID-19	1257925609684119554	http://twitter.com/user/status/1257925609684119554	Няма компания, която може да прогнозира изходът от COVID-19 кризата - Доброслав Димитров, основател на @ImperiaJSC , съосновател на @ITTalents1 и председател на #BASSCOM: https://t.co/El1Hd6hqah #TopManager, #ITIndustry, #COVID19, #Business, #Developers, #softskills, @zoom_us https://t.co/RkqnjeUEMZ	0
COVID-19	1288814858104791040	http://twitter.com/user/status/1288814858104791040	Две нови жертви на Covid-19 във Варна: Във връзка с разпространението на заболяването COVID-19 на територията на гр. Варна и областта, РЗИ Варна информира: В информационната система за COVID-19, към 00 часа на 30 юли, са регистрирани 21 нови случаи на… https://t.co/A9N9pWmyhi	0
COVID-19	1262991854779412481	http://twitter.com/user/status/1262991854779412481	Covid-19 взе 2 жертви във Видинско : https://t.co/odbEXBdbGT https://t.co/UvkKiq3WPy	0
COVID-19	1254017550309941248	http://twitter.com/user/status/1254017550309941248	СЗО: Няма доказателства, че излекуваните от COVID-19 вече имат имунитет срещу вируса https://t.co/7IP1FndIBg	0
COVID-19	1277874575418822657	http://twitter.com/user/status/1277874575418822657	140 новозаразени, премиерът Борисов поиска болниците да се “презапасят с маски, облекла и очила” | 140 са новите случаи на Covid- https://t.co/0IFdcepWLT	0
COVID-19	1299637887105982464	http://twitter.com/user/status/1299637887105982464	Премиерът Бойко Борисов: Общо 72 млн. лв. получиха български малки и микро фирми за преодоляване на икономическите последици от кризата с COVID-19 https://t.co/LNLy1D3D6O	0
COVID-19	1265158232261214209	http://twitter.com/user/status/1265158232261214209	От изследвани 443 проби през последното денонощие, има само шест нови случая на потвърдени заболели от COVID-19 у нас https://t.co/Iy2KFr4m9t	0
COVID-19	1256636448469479424	http://twitter.com/user/status/1256636448469479424	67-годишен мъж от Стрелча е с положителна проба за COVID-19 https://t.co/Dj8YtK8tc3 https://t.co/6q0STmZiL8	0
COVID-19	1265898109688786950	http://twitter.com/user/status/1265898109688786950	Само един починал сред заразените с коронавируса има за последното денонощие в Испания https://t.co/Usnj5kIg7N	0
COVID-19	1246354006106148865	http://twitter.com/user/status/1246354006106148865	Окръжната прокуратура в Монтана разпореди проверка за случая със заразен с COVID-19 пациент от Лом https://t.co/3xZcQPiZ2P	0
COVID-19	1237019838129856512	http://twitter.com/user/status/1237019838129856512	Двамата, настанени в Инфекциозната клиника в Пловдив, нямат коронавирус Започват дезинфекция в градския транспорт Съмнителни за COVID-19 ще бъдат в изолатор в Пазарджик Засилват проверките на ГКПП „Златоград“ заради контрабанда на медицински материали https://t.co/bRyfrGM96E	0
COVID-19	1264492656345993217	http://twitter.com/user/status/1264492656345993217	@wishbonesmile covid causes vagina eye! 😂 някой е измислил как да пуска замаскирани мръсни снимки	0
COVID-19	1274952692717232129	http://twitter.com/user/status/1274952692717232129	прословутата интернет оригиналност, комбинирана със задаване на нивото на нормалност. очаквания айкю резултат е, че има бате олигофрени, които наистина са отговорили с не на въпросите 💉🦍 https://t.co/NRW1JtNZHu	0
COVID-19	1240240065319763968	http://twitter.com/user/status/1240240065319763968	Важно! Застрахователи искат стикерът за Гражданската да отпадне заради COVID-19 : https://t.co/odbEXBdbGT https://t.co/coGdpr9iW7	0
COVID-19	1251198049768128512	http://twitter.com/user/status/1251198049768128512	Бившият шампион в Леката и Свръхлеката категории на UFC, Конър МакГрегър, потърси сметка на ирландската авиокомпания Ryanair, за един чартърен полет от София до Дъблин. #covid19 #конърмакгрегър #софия https://t.co/CPz9TNIKHO https://t.co/KxfvSHTeU1	0
COVID-19	1249068221434601472	http://twitter.com/user/status/1249068221434601472	Във връзка с разпространение на пандемия от Covid-19 Посолство на #Азербайджан 🇦🇿 подари предпазни средства на членове на Съюза на офицерите и сержантите от запаса и резерва на #България 🇧🇬. #COVIDー19 https://t.co/RqCJebl6uE	0
COVID-19	1273183020984532992	http://twitter.com/user/status/1273183020984532992	През изминалото денонощие има 112 заразени с Covid-19 в България, 7 от тях са в Сливен https://t.co/QZrHqZBwNg	0
COVID-19	1261557959563317248	http://twitter.com/user/status/1261557959563317248	Всички се борят с covid-19, Корнелия – с вътрешния враг https://t.co/HpsG4YanJ1	0
COVID-19	1255081557733359616	http://twitter.com/user/status/1255081557733359616	Страховита прогноза за COVID-19 през следващата зима https://t.co/iCEUdmUJhT	1
COVID-19	1290960762589122560	http://twitter.com/user/status/1290960762589122560	Всички тестове за COVID-19 в „Берое“ са отрицателни #beroe #starazagora https://t.co/fgd1xImy78	0
COVID-19	1260993729193807874	http://twitter.com/user/status/1260993729193807874	Тоя Ханке верно е баси изкуфелия дъртак.... https://t.co/Ch058GQFLv	1
COVID-19	1250177960990162946	http://twitter.com/user/status/1250177960990162946	Побъркаха българка с COVID-19 във Варна! https://t.co/iHaEpRMbyo	0
COVID-19	1282295155945545729	http://twitter.com/user/status/1282295155945545729	Пълнени патладжани.... Лятооо 🙂 #SupportYourLocal #restaurant #food #eat #local #foodie #instafood #dinner #bar #lunch #delicious #chef #Sofia #VelikoTarnovo #StaraZagora #Bulgaria #PartOfYourStory https://t.co/GGldS52W9M	0
COVID-19	1252148635934040065	http://twitter.com/user/status/1252148635934040065	Данни от Брюксел: България има най-ниска заболеваемост от Covid-19 в ЕС https://t.co/9VOtVIRmaL	0
COVID-19	1297793215261802496	http://twitter.com/user/status/1297793215261802496	240 души от региона са преборили COVID-19, осем са починалите https://t.co/kgd8iQFba3	0
COVID-19	1278581307488911361	http://twitter.com/user/status/1278581307488911361	Четири деца детска градина в София са с положителни проби за COVID-19 (ВИДЕО) https://t.co/v9fcsMbea5	0
COVID-19	1270660292209500160	http://twitter.com/user/status/1270660292209500160	Засега няма да се затварят детските градини заради Covid-случаите в 50-а https://t.co/wyr0MwhdAD	0
COVID-19	1271712368779825153	http://twitter.com/user/status/1271712368779825153	(Проф. Константинов: "Влязохме във фазата "хищника и жертвата"") от Зарата - Новини - https://t.co/KUptBbgyyQ #новини #COVID19 #профКонстантинов https://t.co/aFK3huoFr4	0
COVID-19	1249336478871805952	http://twitter.com/user/status/1249336478871805952	Шест държави в Европа имат над 10% смъртност от COVID-19, в света начело е САЩ https://t.co/q4RIEKlvx3	0
COVID-19	1249033827063861254	http://twitter.com/user/status/1249033827063861254	КОВИД 19 - Хората не са виновни, #StayHome, #коронавирус, #ковид19, #cov... https://t.co/IBAFuanbE8 via @YouTube #коронавирус,#ковид19,#covid19,епидемия,пандемия,вирус,#вирус,#пандемия,извънредно,#извънредно,извънредно положение,	0
COVID-19	1281127413393567744	http://twitter.com/user/status/1281127413393567744	@GStrahilova И вчера и денс и месец каза методиката е еднаква - PCR, така че може спокойно да сравнявате. Броят тестове е даден в ежедневното прессъобщение. В първите седмици не го даваха, но това отдавна е оправено. https://t.co/FiruDWYbDE	0
COVID-19	1248107816507883520	http://twitter.com/user/status/1248107816507883520	Тишината вали във прозореца.. https://t.co/Hd0DxCbv60 via @GoogleNews	0
COVID-19	1253566386313531392	http://twitter.com/user/status/1253566386313531392	Безсъние и ярки сънища в стаята с тревожност COVID-19 https://t.co/kqGg0D6WMJ	0
COVID-19	1247548186643890177	http://twitter.com/user/status/1247548186643890177	Нова жертва на COVID-19 у нас, почина мъж на 36 години https://t.co/qQhefqVmmV	0
COVID-19	1295338826513162241	http://twitter.com/user/status/1295338826513162241	Починала от COVID-19 лекарка до последно питала за пациентите си https://t.co/YUp7m6ykbw	0
COVID-19	1234027000534355971	http://twitter.com/user/status/1234027000534355971	@No_name_No_user Ето го интервюто, ако @yurukov е по-добре с немския от мен да го преразкаже, моля.😊 https://t.co/2mnGqFe1NP	0
COVID-19	1254709539158581248	http://twitter.com/user/status/1254709539158581248	Хенри Кичка - оцелелият от Аушвиц белгиец, който почина от COVID-19 https://t.co/PZn3I4dp5G	0
COVID-19	1226173925396242435	http://twitter.com/user/status/1226173925396242435	Вероятно Китай не казва точните цифри на мащабите, които са засегнали хората. https://t.co/glYtKqZ7ra	1
COVID-19	1290906481261453312	http://twitter.com/user/status/1290906481261453312	COVID-19 прекъсвало програмите за лечение на други болести https://t.co/eBbaC6mndn	0
COVID-19	1297849976651952128	http://twitter.com/user/status/1297849976651952128	Таня Андреева: Не се сбъдна прогнозата, че след изолацията заради COVID-19 ще има бейби бум https://t.co/8DP5rEUxV7	0
COVID-19	1280013786364215297	http://twitter.com/user/status/1280013786364215297	63 са новите случаи на заразени с коронавирус у нас при направени само 923 теста, в Сливенско има 1 с Covid-19 https://t.co/5B1LaxGXPg	0
COVID-19	1245688583274594305	http://twitter.com/user/status/1245688583274594305	Sony дарява 100 милиона долара в помощ за борбата срещу COVID-19 #Sony https://t.co/Mz7yG4z9QA https://t.co/UljmLRdxTJ	0
COVID-19	1279467262236340225	http://twitter.com/user/status/1279467262236340225	Ама не им давайте идеи на нашите управници, моля! https://t.co/RUuD9pasyF	0
COVID-19	1272783636149022720	http://twitter.com/user/status/1272783636149022720	51 нови заразени с COVID-19 в страната https://t.co/ibYxBdZsPk	0
COVID-19	1256480158753738753	http://twitter.com/user/status/1256480158753738753	Щабът: Ленин е починал от COVID-19, антиреволюционна (ди)версия https://t.co/YQcKKjdMas	0
COVID-19	1296530938139160577	http://twitter.com/user/status/1296530938139160577	Имах недалновидността да пусна Марияна Николова, за да се информирам какво казва, докато имам приятели на гости... Ски спортът е защитен от COVID19, защото спускането е индивидуално предизвика такъв смях, че се чувствам притеснена някой да не остане без въздух. #Kakistocracy	0
COVID-19	1255768199498551305	http://twitter.com/user/status/1255768199498551305	20 000 долара струва престоят в болница с COVID-19 в САЩ https://t.co/lh6rPdjJaE	0
COVID-19	1239786665058734083	http://twitter.com/user/status/1239786665058734083	Трябва да се учи статистика и пробабилистика... https://t.co/f2Rc0O5AQm	0
COVID-19	1254125920916516864	http://twitter.com/user/status/1254125920916516864	COVID-19 в региона на Югоизточна Европа https://t.co/mBmDW7FGR2	0
COVID-19	1241259339807162368	http://twitter.com/user/status/1241259339807162368	Нямаме идея какво трябва да се направи, но е важно да го направим сега! 🤣🤣🤣 https://t.co/qyjxvWcaQm	0
COVID-19	1236421411176136705	http://twitter.com/user/status/1236421411176136705	Номер 2 и 4 веднага на първите места. #COVID19 https://t.co/JAntcvuG7x	0
COVID-19	1281619660715298817	http://twitter.com/user/status/1281619660715298817	Германска компания води в надпреварата за ваксина срещу COVID-19 https://t.co/09UoBAQzce	0
