topic	tweet_id	tweet_url	tweet_text	class_label
COVID-19	1247188202370326528	http://twitter.com/user/status/1247188202370326528	ЕС планира мерки за подкрепа на селскостопанските производители в Европа. Сред тях: ✅ Удължаване на срока за кандидатстване за директно финансиране ✅ Увеличаване на размера на предварителните плащания ✅Премахване на административната тежест #coronavirus https://t.co/xhZDrB4qkH	0
COVID-19	1280098239933558785	http://twitter.com/user/status/1280098239933558785	Български екип е много близо до откриването на лекарство срещу #COVID19 https://t.co/WKLbzJKscZ	0
COVID-19	1260494888031916033	http://twitter.com/user/status/1260494888031916033	Борбата с дезинформацията е общо усилие, включващо всички европейски граждани. ЕС също помага за борба с дезинформацията чрез тясно сътрудничество с онлайн платформите: https://t.co/475gAeRinz #ЕвропаСрещуCOVID19	0
COVID-19	1282936102203072512	http://twitter.com/user/status/1282936102203072512	#ЕвропаСрещуCOVID19 Медицинските работници продължават да се борят срещу коронавируса, а европейци изразяват признанието по различни начини. С други доброволци Момчил дезинфекцира в „Пирогов“: „Трябваше да направя нещо. Не можех просто да седя безучастно.“ https://t.co/1C24ZUsaI4 https://t.co/phwJN5GAjm	0
COVID-19	1247856774658641920	http://twitter.com/user/status/1247856774658641920	Проучване на ЕК за справянето с кризисната ситуация във връзка с COVID-19 https://t.co/9jNsv2hnzM	0
COVID-19	1247441768892772352	http://twitter.com/user/status/1247441768892772352	Като резултат от пандемията COVID-19 и затварянето на образователните институции в целия свят, стартираха инициативи за осигуряване на ученето и преподаването в този период. Вж проучване от Европейската комисия стартира: https://t.co/9jNsv2hnzM	0
COVID-19	1261697669430419457	http://twitter.com/user/status/1261697669430419457	- covid е измама - пуснат е нарочно - като грип е, има го от 2014; мои познати го изкараха още януари! - в Англия мерките изобщо не са били толкова строги и едва сега ги затегнали - неслучайно UK се махнали от EU - в Холандия никакви мерки не взимали - нас ни лъжат	1
COVID-19	1285454152919908352	http://twitter.com/user/status/1285454152919908352	Човешката #храна и начинът на производството й се оказват основни фактори при разпространението на смъртоносни #вируси като #COVID19 #коронавирус #пандемия https://t.co/I2xb6PDf7L	0
COVID-19	1275459790865682432	http://twitter.com/user/status/1275459790865682432	Понеже от доста време смятам, че подмятането само на някаква цифра новозаразени хора не показва ситуацията адекватно за разлика от процента положителни проби направих тази графика за да видя какво се случва всъщност. #coronavirus https://t.co/q3inwsKxOe	0
COVID-19	1250352388101173248	http://twitter.com/user/status/1250352388101173248	Николай Пловдивски освещава новата лаборатория за Covid-19 в Пловдив, построена на гола поляна за 30 дни. Ето че и ние можем като китайците 😂 https://t.co/DaMI2lRgQd	0
COVID-19	1258670457454198787	http://twitter.com/user/status/1258670457454198787	#България насочи още 134 млн. лв. за #МСП и #икономиката чрез Оперативна програма "#Иновации и #конкурентоспособност". С тези #инвестиции страната мобилизира над 1 млрд. лв. #еврофинансиране в борбата с икономическите последици от #COVID19: https://t.co/wKnPGYSlNQ https://t.co/XveQGsx1F1	0
COVID-19	1242423351550676993	http://twitter.com/user/status/1242423351550676993	Коронавирусът в Южна Корея, защо нямаше пълна карантина и как се справят с разпространението на #covid19 https://t.co/KIi5AAK2qL	0
COVID-19	1271349901839020032	http://twitter.com/user/status/1271349901839020032	По време на пандемията с #COVID19 българските тийнейджъри са гневни в емоциите си, но дисциплинирани в поведението си. Търсят достоверни източници на информация, но се ядосват, когато тя е противоречива и това ги тласка към конспиративни теории. Повече тук https://t.co/5uBcLswbUP	0
COVID-19	1278226582549811200	http://twitter.com/user/status/1278226582549811200	Бързото и надеждно тестване е ключово за спирането на #COVID19. Научете как европейското финансиране помага на компания в Дъблин да разработи тестове, които дават резултат в рамките на час ↓ https://t.co/2aaMp2TCCf	0
COVID-19	1290220377965096961	http://twitter.com/user/status/1290220377965096961	Дом за стари хора и лица с деменция се превърна в огнище на Covid-19 във Варна: Във връзка с разпространението на заболяването COVID-19 на територията на гр. Варна и областта, РЗИ Варна информира: В единния информационен портал за COVID-19, за последните… https://t.co/CWy8ZE6QqT	1
COVID-19	1283865298106494980	http://twitter.com/user/status/1283865298106494980	Посланик на #Азербайджан: #Армения започна тази атака по времето, когато международната общност обединява усилията си за борба с COVID-19. https://t.co/N1p5CMPUc5	1
COVID-19	1275052469391953920	http://twitter.com/user/status/1275052469391953920	Децата и семействата с деца, спазвали мерките за социална дистанция са засегнати четири пъти повече от .... #COVID19 https://t.co/FrHuj002Dx	0
COVID-19	1264150833823805442	http://twitter.com/user/status/1264150833823805442	ЕС помага на финансовия сектор и на бизнеса за преодоляване на последиците от кризата с #COVID19. Вижте хронологията на мерките срещу пандемията: https://t.co/nK8VJWjxZS #ЕвропаСрещуCOVID19 https://t.co/HcA40Q4wXz	0
COVID-19	1248602790122962944	http://twitter.com/user/status/1248602790122962944	Специална програмa за електронни магазини на дребно по време на пандемията от COVID-19 за повишаване на продажбите с безплатно ползване на технология за интелигентно търсене на QuarticOn, базирана на изкуствен интелект, в продължение на 3 месеца. https://t.co/aRzbKzXSlA https://t.co/bTic7O62et	0
COVID-19	1253301179389534209	http://twitter.com/user/status/1253301179389534209	Радев: Тестването за COVID-19 трябва да обхване повече групи - https://t.co/9c16e2Yf7E	0
COVID-19	1254068960745656322	http://twitter.com/user/status/1254068960745656322	Липсват животоспасяващи лекарства за хората с епилепсия https://t.co/8QsLIveHym чрез @centerprh	0
COVID-19	1275063971926560776	http://twitter.com/user/status/1275063971926560776	Прокуратурата иска проверка ефикасни ли са мерките срещу COVID-19 и трябват ли нови - https://t.co/nk5KnDlKme https://t.co/PjFFzltpvW	0
COVID-19	1246317878888091652	http://twitter.com/user/status/1246317878888091652	ЕМА: Действието на хлорохин и хидроксихлорохин при COVID-19 не е доказано https://t.co/nTBbPsNGgy чрез @centerprh	0
COVID-19	1259764537470914561	http://twitter.com/user/status/1259764537470914561	Ако у нас имаме втора вълна на вируса, безработицата е възможно да мине 10%. Това прогнозира икономистът Румен Гълъбинов в сутрешния блок на БТВ. #новини #еврозона #безработица #коронавирус #пандемия #икономическиживот https://t.co/VVQM7kONIN	0
COVID-19	1275776473694167041	http://twitter.com/user/status/1275776473694167041	Удължава се извънредната #епидемична обстановка #COVID19 https://t.co/85Qg1j5C5z	0
COVID-19	1260856755103424513	http://twitter.com/user/status/1260856755103424513	СЗО: COVID-19 може никога да не изчезне - https://t.co/nk5KnDDlKO https://t.co/eE2JmSdMxa	1
COVID-19	1286534449350553600	http://twitter.com/user/status/1286534449350553600	ЕК със стратегия за безопасна и ефикасна ваксина срещу COVID-19 https://t.co/heBIsPPZpf	0
COVID-19	1249668666804838401	http://twitter.com/user/status/1249668666804838401	Учени от "Оксфорд" може да открият ваксина срещу COVID-19 до септември https://t.co/R5CoGzrXhm	0
COVID-19	1296447814260727808	http://twitter.com/user/status/1296447814260727808	Затварянето на училищата заради COVID-19 промени изцяло учебните занятия на децата. УНИЦЕФ разработи документ, който да подкрепи учителите, директорите, децата и родителите при възстановяването на образованието в училищата. ➡️https://t.co/gaAabamAhb #ЗаВсякоДете – образование https://t.co/baag657oOU	0
COVID-19	1272235834113241089	http://twitter.com/user/status/1272235834113241089	В Сектор Г виси плакат "COVID-19 - част от новия световен ред!" #нимоа https://t.co/xvrtrDXMNb	1
COVID-19	1257594761596321792	http://twitter.com/user/status/1257594761596321792	Израел и Нидерландия с пробив срещу COVID-19 - изолирали моноклонално антитяло https://t.co/3Zq4kUrxDd	0
COVID-19	1263103908836081665	http://twitter.com/user/status/1263103908836081665	Нов ден! За втори ден оздравелите от COVID-19 са повече от заразените https://t.co/AaracYoV7o Абонирайте се: Spotify -&gt; https://t.co/0WI20cEFkv Apple -&gt; https://t.co/Naf2k0Ijb8 Google -&gt; https://t.co/M2MJ9V9Ogi	0
COVID-19	1269909754211696642	http://twitter.com/user/status/1269909754211696642	26 жени са положителни за COVID-19 в цеха в Доспат - https://t.co/nk5KnDDlKO https://t.co/cR2FVAzMtb	0
COVID-19	1282751437638897666	http://twitter.com/user/status/1282751437638897666	Официално Григор Димитров е с отрицателен резултат за Covid-19! https://t.co/jNuUiGr8Hq @GrigorDimitrov	0
COVID-19	1249203095957053441	http://twitter.com/user/status/1249203095957053441	669 души са заразените с Covid-19 в България https://t.co/9lNZhr3SNO	0
COVID-19	1285789554239209472	http://twitter.com/user/status/1285789554239209472	COVID-19: Митът за платените болни https://t.co/L6PiPxk1xI чрез @toestbg	0
COVID-19	1292339046367322113	http://twitter.com/user/status/1292339046367322113	Жените предприемачи като Meira Foods, Rima Foods и Lambu-Subu Food &amp; Beverages се подкрепят за създаване на интегрирани преработвателни единици, които от своя страна са свързани с организации на производители на фермери за доставка на плодове, черен ориз и др. #AatmaNirbharKrishi https://t.co/4ibD1bt1Xz	0
COVID-19	1261308244879970307	http://twitter.com/user/status/1261308244879970307	Министърът на здравеопазването на България #КирилАнаниев нарежда със Заповед РД-01-264/14.05.2020г. да се вкарат в болницата ЗАДЪЛЖИТЕЛНО всички възрастни над 60 год, положително тествани за #COVID19 БЕЗ ЗНАЧЕНИЕ дали имат симптоми или не.	0
COVID-19	1289800603640557568	http://twitter.com/user/status/1289800603640557568	Кой носи отговорност и колко струва: ЕС опитва да се сдобие с ваксини срещу COVID-19 https://t.co/a1j9bH9nfI	0
COVID-19	1295606360730738690	http://twitter.com/user/status/1295606360730738690	#Ангел #Кунчев: „Присъственото обучение в #училищата няма да доведе до #епидемични #взривове, то работи в детските градини“ #COVID19 @MyFamilyBg https://t.co/9eOEvSadXH	0
COVID-19	1254602061783748613	http://twitter.com/user/status/1254602061783748613	За ЕК основен приоритет е здравето на гражданите. Пандемията от #coronavirus обаче е голямо сътресение за икономиката. За да защити поминъка и икономиката на хората, ЕК прие цялостен икономически отговор на епидемията с широкомащабни мерки →https://t.co/Z2sTGNIrY4 https://t.co/NHVeMZ1CEK	0
COVID-19	1244540705701322752	http://twitter.com/user/status/1244540705701322752	8 са новите случаи на заразени с COVID-19 в България https://t.co/yToquVuyHc	0
COVID-19	1265590210039099393	http://twitter.com/user/status/1265590210039099393	Разследвани губернатори в цяла Латинска Америка и арест на министър в Боливия заради злоупотреби със средства, предвидени за борбата с COVID-19. https://t.co/FQXfXdu8Aa	0
COVID-19	1271700389876957184	http://twitter.com/user/status/1271700389876957184	Персосналът в детските градини в Ямбол ще бъде тестван за COVID-19 https://t.co/jArEcg56fl	0
COVID-19	1289488430787772418	http://twitter.com/user/status/1289488430787772418	19-годишен младеж почина от COVID-19 във В.Търново https://t.co/VFkZUIBzni	1
COVID-19	1276048048192466944	http://twitter.com/user/status/1276048048192466944	Кризата с коронавируса направи много компании в ЕС уязвими за субсидирани конкуренти от чужбина. Евродепутатите искат правилата на честна конкуренция да важат за всички: https://t.co/nGFgRwwQzz #ЕвропаСрещуCOVID19 https://t.co/nAdTGqYhe7	0
COVID-19	1253648248746713096	http://twitter.com/user/status/1253648248746713096	Нов ден! Защо COVID-19 не се лекува с инжектиране на белина и UV светлина https://t.co/FyTHJTsKYB Абонирайте се: Spotify -&gt; https://t.co/0WI20cn4sX Apple -&gt; https://t.co/Naf2k0qIjA Google -&gt; https://t.co/M2MJ9USdoK	0
COVID-19	1288957860009910272	http://twitter.com/user/status/1288957860009910272	265 са новозаразените с Covid 19, а настанените в болница стигнаха 751 https://t.co/XxgqRStdJz	0
COVID-19	1272409770742423552	http://twitter.com/user/status/1272409770742423552	24 са новите случаи на COVID-19 и двама починали за денонощие https://t.co/jE7tk9KnDU	1
COVID-19	1283476035196125187	http://twitter.com/user/status/1283476035196125187	В момента от 40 легла в #COVID19 отделението на Клиниката по инфекциозни болести към Университетската болница "Св.Георги" са заети 35 с болни в средно тежка и тежка форма. https://t.co/OiMNjzjfUX	0
COVID-19	1242391062934622208	http://twitter.com/user/status/1242391062934622208	Регионалното министерство пренасочва 40 млн. лв. за респиратори, маски и тестове за COVID-19 https://t.co/eEurWCudii	0
COVID-19	1260117258686398464	http://twitter.com/user/status/1260117258686398464	д-р Веселин Йолов за истерията с епидемията от #Covid19 - #живейте и правете #спокойно проектите за живота си. Коронавирусът е много опасно заболяване, което поразява #психиката на хората... https://t.co/CIaSRVybFt	0
COVID-19	1276222991769223168	http://twitter.com/user/status/1276222991769223168	Проучване на @Reuters: #България се готви за трудно #лято #COVID19 #Туризъм https://t.co/YwC6AxLICr	0
