topic	tweet_id	tweet_url	tweet_text	class_label
COVID-19	1265582646836551681	http://twitter.com/user/status/1265582646836551681	Възстановяване още тази година, ако няма втора вълна на Covid-19 https://t.co/pUuCiSKvfA via @ikj_bg	0
COVID-19	1249639517025439745	http://twitter.com/user/status/1249639517025439745	Опитах се да тренирам, но след 10 минути бях смазан: Паоло Малдини разказва за възстановяването си след COVID-19 https://t.co/6RJjwyoiRk	0
COVID-19	1251048778758606848	http://twitter.com/user/status/1251048778758606848	73-годишна от Пещера е поредната жертва на COVID-19, излекувана е жената от Сарая https://t.co/jK36VHS9pF	1
COVID-19	1280069807316975617	http://twitter.com/user/status/1280069807316975617	Ути Бъчваров: Питаха ме взел ли съм пари, за да кажа, че имам COVID-19 https://t.co/9TjDbJq5tV	1
COVID-19	1236711166623322112	http://twitter.com/user/status/1236711166623322112	Само вижте последния ред умрели днес срещу възстановили се за последните 24 часа. https://t.co/BStkGEn6q3	1
COVID-19	1252355102125350912	http://twitter.com/user/status/1252355102125350912	World of Warcraft пандемия от 2005-та може да помогне на изследователи в борбата срещу Covid-19 https://t.co/DKgrf0u98C https://t.co/hpLEnyIZWv	0
COVID-19	1296372048730763266	http://twitter.com/user/status/1296372048730763266	„Имаме много доказателства, че това е фалшива история навсякъде по света“ - Немски лекари на COVID-19 https://t.co/BBobxnbrNP	1
COVID-19	1275005128878297089	http://twitter.com/user/status/1275005128878297089	Депутатите не искат да се стига до полупостоянен контрол на вътрешните граници в зоната на Шенген. Прочетете за пътя към отварянето на границите след кризата с #COVID19 → https://t.co/hpg4oYhgAJ https://t.co/oJbcNol57L	0
COVID-19	1280805028752695296	http://twitter.com/user/status/1280805028752695296	Официално за "Локо": 2 играчи и 4 фена с COVID - 19. Има нови заразени в дискотеки. С вируса е и бебе - DC news https://t.co/BLqBJeueEn	1
COVID-19	1252617226458456066	http://twitter.com/user/status/1252617226458456066	Най-честите нарушения са неспазването на дистанция и задължителните хигиенни изисквания. Много от пазаруващите продължават да влизат в магазините без маски https://t.co/qMSsT0D2Vf	0
COVID-19	1239288784254009346	http://twitter.com/user/status/1239288784254009346	Най-много смъртни сучай : Китай - 3199 / Италия - 1,809 / Иран - 724 / Испания - 292 / Франция - 127 / Северна Корея - 75 / САЩ - 63 / Обединено Кралство - 35 / Япония - 24 / Холандия - 20 #COVIDー19 #корона #вирус #коронавирус #България #новини #информация #АпоВик	0
COVID-19	1251390646100819969	http://twitter.com/user/status/1251390646100819969	865 са случаите на COVID-19 у нас, заразено е бебе на 2 месеца - bTV Новините https://t.co/HRppflhTOu	0
COVID-19	1294702688446353408	http://twitter.com/user/status/1294702688446353408	От понеделник, 17 август 2020 г. в 00.01 ч., всички влизащи в Гърция трябва да представят отрицателен резултат от PCR тест за COVID-19. За децата родени след 1 януари 2011 г. не се изисква PCR тест за COVID-19.	0
COVID-19	1266268608734179328	http://twitter.com/user/status/1266268608734179328	Над 130 души с COVID-19, от които само 40 са били с положителна PCR реакция, са били лекув... https://t.co/NtvGdcsH6N	1
COVID-19	1255364986211315716	http://twitter.com/user/status/1255364986211315716	Три нови жертви на Covid-19 са регистрирани през последното денонощие. Новите случаи са 50. https://t.co/Ml2WfuRFdx	0
COVID-19	1298515100425428992	http://twitter.com/user/status/1298515100425428992	Разрушаване: FDA спира използването на кръвна плазма при лечение на COVID https://t.co/KgrHt0llAR	0
COVID-19	1252148997382385665	http://twitter.com/user/status/1252148997382385665	(И жена на 62 г. е заразена в Паничерево. Огнището е рекордьор по коронавирус на глава от населението - 14 доказани) от Зарата - Новини - https://t.co/YI43xBqluy #новини #COVID19 #Паничеревокарантина https://t.co/NCzjNqYHYt	1
COVID-19	1256474761967939585	http://twitter.com/user/status/1256474761967939585	САЩ одобриха противовирусно лекарство за лечение на COVID-19 https://t.co/F2GudMnqlP	0
COVID-19	1251401064412180482	http://twitter.com/user/status/1251401064412180482	865 са потвърдените случаи на COVID-19 у нас. Общо за последните 24 часа новите положителн... https://t.co/HodG9qpiUK	1
COVID-19	1261771134317494272	http://twitter.com/user/status/1261771134317494272	етака ги лекува доктор тръмпутю... https://t.co/qOnZ5VDZWH	0
COVID-19	1291348326185603073	http://twitter.com/user/status/1291348326185603073	Община „Марица“ преустановява работа днес и утре поради установено заболяване с COVID-19 на служител в общинска администрация. Служителите няма да се допускат до работните им места, гласи заповедта на зам-кмета на общината Гергана Титюкова https://t.co/9guJIWWdrx	0
COVID-19	1271285097417732099	http://twitter.com/user/status/1271285097417732099	Общият брой заразени с COVID-19 в България надхвърли 3000 https://t.co/ohDkwV9kFw	1
COVID-19	1294655274620456961	http://twitter.com/user/status/1294655274620456961	Двама лекари от Добрич загубиха битката с Covid-19 https://t.co/YaMI0CtrE7	1
COVID-19	1272761633497067520	http://twitter.com/user/status/1272761633497067520	Българин с Covid-19 излетя от София, но го спипаха в... : https://t.co/odbEXBdbGT https://t.co/6fqo2DbUjq	0
COVID-19	1274635484216659972	http://twitter.com/user/status/1274635484216659972	Положителен тест за COVID-19 в ЦСКА. Е сега гръмна цялото първенство.	0
COVID-19	1290352277132279808	http://twitter.com/user/status/1290352277132279808	102 души от дом за възрастни във Варна са заразени с COVID-19 https://t.co/pdLnFBSroy	1
COVID-19	1270614420536922113	http://twitter.com/user/status/1270614420536922113	Три учителки от столична детска градина са с положителен резултат за Covid-19 https://t.co/jneHYx4yaf	1
COVID-19	1242749319830278145	http://twitter.com/user/status/1242749319830278145	Столична община с единна информационна система за COVID-19 https://t.co/E6wLs8nboV	0
COVID-19	1281123547214217217	http://twitter.com/user/status/1281123547214217217	Заразени с COVID-19 българи се върнаха от остров Тасос https://t.co/t89HZkrgnk	1
COVID-19	1296918708594642953	http://twitter.com/user/status/1296918708594642953	Образователен експерт: „Само учениците с хронични заболявания в 5-12 клас ще могат да бъдат в дистанционна форма“ https://t.co/KzxR7ZJ6bl via @@danyboneva	0
COVID-19	1256993235962073089	http://twitter.com/user/status/1256993235962073089	Това е третият установен случай с положителна проба на санитарка от МБАЛ – Смолян, като предишните два случая са свързани с кардиологията https://t.co/ZZ4guo8eyN	1
COVID-19	1240523692486074369	http://twitter.com/user/status/1240523692486074369	94 станаха заразените с covid-19 в България, 3 починали https://t.co/XyvRK6q8Pg	1
COVID-19	1293852606369017856	http://twitter.com/user/status/1293852606369017856	Местни земеделски стопани приветстват извънредното подпомагане за COVID : Вестник Знаме - новини Пазарджик и областта https://t.co/YagurDYuka	0
COVID-19	1286255525152337921	http://twitter.com/user/status/1286255525152337921	Коронавирусът и по-склонни ли сме да се заразим с COVID-19 у дома, отколкото са публично място https://t.co/kwEbo3I6PT	0
COVID-19	1266040023222226947	http://twitter.com/user/status/1266040023222226947	Великобритания с най-висока смъртност от Covid-19 https://t.co/N1Xq1WtmPR	0
COVID-19	1294504407397281794	http://twitter.com/user/status/1294504407397281794	174 нови случая на коронавирус за последното денонощие #COVID19 https://t.co/tzcRL8cZXG	0
COVID-19	1258411526978826243	http://twitter.com/user/status/1258411526978826243	За първи път: Откриха Covid-19 в стомашната течност на пациент https://t.co/udIzmBUSo1	0
COVID-19	1250717580567945217	http://twitter.com/user/status/1250717580567945217	@ApostolDyankov Ето ги условията за “безусловния” еднократен доход (който не покрива и половин наем в по-големите градове): https://t.co/MEandXS80f	0
COVID-19	1254297634052939777	http://twitter.com/user/status/1254297634052939777	градът отговаря на всички изисквания за провеждане на това срезово изследване на населението. Намира се в центъра на България, могат да се обхванат различни групи от жителите и не на последно място здравната система има капацитет и е добре подготвена https://t.co/c3ol7VatAp	0
COVID-19	1256594465348825089	http://twitter.com/user/status/1256594465348825089	1594 са потвърдените случаи на COVID-19 у нас, нови заразени в Сливен https://t.co/WmGbkrQhR2	0
COVID-19	1289155961119215617	http://twitter.com/user/status/1289155961119215617	През последните месеци кризата с COVID-19 ограничава пътуванията у нас и в чужбин... https://t.co/mb095urZjZ	0
COVID-19	1280377207614029824	http://twitter.com/user/status/1280377207614029824	7 са заразените с Covid-19 в Сливенско през изминалото денонощие https://t.co/UpGQGj3WbM	0
COVID-19	1245586422846767105	http://twitter.com/user/status/1245586422846767105	#Covid19 ще фалира повече хора, отколкото ще убие. Ама нали това е идеята.	1
COVID-19	1282213885655879680	http://twitter.com/user/status/1282213885655879680	САЩ регистрираха над 66 500 заразени с COVID-19 за 24 часа https://t.co/wyvAXeYpQi btvnovinite	1
COVID-19	1273354908822114309	http://twitter.com/user/status/1273354908822114309	@bgMamaMilf Братовчедка ми, която специализира вирусология и работи във ВМА, се оплакваше, че не знае дали ще им разрешат отпуски тази година - толкова много работа имат покрай covid-19. Каза, че ни спасява, че лятото наистина има по-малко болни, което дава време за пробив за лечение	1
COVID-19	1274921893917872128	http://twitter.com/user/status/1274921893917872128	Изследваха за Covid-19 две фелдшерки от Враца : https://t.co/odbEXBdbGT https://t.co/z3Aw3NbBqp	1
COVID-19	1266327066552737793	http://twitter.com/user/status/1266327066552737793	#Испания улеснява престоя за чужденци в условията на #COVID19 Covid-19 https://t.co/25jSTxOP53	0
COVID-19	1295609999234916353	http://twitter.com/user/status/1295609999234916353	В световен мащаб броя на младите хора - между 20 и 50 години, заразени с Covid-19, драстично нараства. Това е притеснително, тъй като много от тях не проявяват симптоми и поради тази причина не са диагностицирани. https://t.co/znnjUcE608	1
COVID-19	1263078772531769344	http://twitter.com/user/status/1263078772531769344	Световната банка: 60 милиона души са заплашени от крайна бедност заради COVID-19 https://t.co/aiqlywP8BR	1
COVID-19	1252117521051856898	http://twitter.com/user/status/1252117521051856898	Между 10 и 20% от инфектираните в САЩ, Испания и Италия са медицински работници. При нас са под 10%. https://t.co/VEGlU9bxrq	0
COVID-19	1263358875534798849	http://twitter.com/user/status/1263358875534798849	280 хил. души в България са се срещнали с COVID-19 https://t.co/qstG4ayLOY	1
COVID-19	1252164362330083328	http://twitter.com/user/status/1252164362330083328	Поляците създават проблеми на всички. Ирландците се срещат с евтино говеждо. Ние пък всяка година се срещаме с евтините им картофи. Ирландците имат проблем с лошите зоохигиенни условия в полските ферми. Ние пък много добре знаем за лошите фитосанитарни условия в полските полета. https://t.co/DBLwZNfLE6	0
COVID-19	1251390987945082882	http://twitter.com/user/status/1251390987945082882	(Бебе на 2 месеца е с COVID-19, заразените са вече 865) от Зарата - Новини - https://t.co/I4yjcaUAPC #новини #коронавирус https://t.co/u5menihGah	1
COVID-19	1295623306419281922	http://twitter.com/user/status/1295623306419281922	Децата може би разпространяват COVID-19 по-бързо, отколкото се предполагаше първоначално https://t.co/Pa9n2f4GRY	1
COVID-19	1254643098048749568	http://twitter.com/user/status/1254643098048749568	Плевен изпревари София по заразени с Covid-19, във Видин няма нито 1! : https://t.co/odbEXBdbGT https://t.co/AuauQV3BHc	1
COVID-19	1290640839320965122	http://twitter.com/user/status/1290640839320965122	Мерките срещу Covid-19 у нас остават, на този етап няма да се разширяват https://t.co/QIpqyE65lt via @poligraff.net	0
COVID-19	1291676017195712513	http://twitter.com/user/status/1291676017195712513	Бил Гейтс: Климатичните промени ще убият повече хора от COVID-19 https://t.co/6A2uKvdUm6	0
COVID-19	1286031045352202240	http://twitter.com/user/status/1286031045352202240	BGpravda: В България плащаме най-скъпо за изследване за COVI... https://t.co/4XUjrXuwMf	1
COVID-19	1273934945581441024	http://twitter.com/user/status/1273934945581441024	#Новини Златото продължава с възходящото си движение В петък цените на златото се повишиха отново заради опасенията от втора вълна от #COVID19. Спот златото се повиши с 0,5% до $1,731 за #тройунция, а фючърсите върху златото в САЩ се повишиха с 0,4% до $1,738.80 за #тройунция. https://t.co/yNo776gAdZ	0
COVID-19	1269152019450859520	http://twitter.com/user/status/1269152019450859520	41 случая на заразени с COVID-19 за последното денонощие. Един е починал https://t.co/57cU7ioEUt	1
COVID-19	1273165329817010178	http://twitter.com/user/status/1273165329817010178	Пакистан регистрира рекорден брой починали от COVID-19 https://t.co/mYFTPBsWQD	1
COVID-19	1295670535356133377	http://twitter.com/user/status/1295670535356133377	Така е. Депресията е цялостно потискане на жизнеността във всички сфери, диктатурите и репресиите я увеличават. Протестите и бунтовете я лекуват. https://t.co/dmCh1mpNa5	0
COVID-19	1256161449958871040	http://twitter.com/user/status/1256161449958871040	Бил Гейтс е оптимист, че до 18 месеца ще има ваксина за Covid-19 https://t.co/JyOQek5Lat	0
COVID-19	1252120057557274624	http://twitter.com/user/status/1252120057557274624	Това е 60-годишна жена -дерматолог от доболничната помощ. Тя е в добро общо състояние. Намира се в дома си. Установено е, че е била контактна със заразна жена на 84-години, установена преди няколко дни https://t.co/fWPF4FFUHL	0
COVID-19	1240616692541161472	http://twitter.com/user/status/1240616692541161472	Британци хвалят България за мерките против COVID-19 и хулят своето “непотребно и безразлично правителство“ https://t.co/9rLhrMPDFZ	0
COVID-19	1269025432646627329	http://twitter.com/user/status/1269025432646627329	@yurukov Днес се опитаха да ми обяснят как в болницата са предложили 3000лв. на човек за да му напишат диагноза Covid-19. Също така ми дадоха за пример Беларус където нямало никакви ограничения и всичко било наред, а при нас нещата са преувеличени с всички тези мерки. Нямам думи вече.	1
COVID-19	1271378624634073088	http://twitter.com/user/status/1271378624634073088	Шефът на митниците с COVID-19, лекува се във ВМА https://t.co/LbEYT69nis	0
COVID-19	1253687927252701186	http://twitter.com/user/status/1253687927252701186	@OuroborosGebo Мисля, че изказването му се базира на това, конкретно за слънчевата светлина: https://t.co/XuIyIEj7YL https://t.co/amIDBS74k2	0
COVID-19	1226934330720706560	http://twitter.com/user/status/1226934330720706560	Гледам, че масово игнорираме проблема, но току-що научих, че са открили нов вирус с неизвестна ДНК в Бразилия! Ей така да го спомена само... 🙄 https://t.co/pBU9B1Jgy5	1
COVID-19	1269241384361431041	http://twitter.com/user/status/1269241384361431041	СЗО: Опасността от CОVID-19 не е отминала https://t.co/RhEBHMB0ey	1
COVID-19	1288075485457584135	http://twitter.com/user/status/1288075485457584135	И Кипър наложи карантина на пристигащи от България заради COVID-19 https://t.co/DkHz2uWh3a	0
COVID-19	1242151933441343490	http://twitter.com/user/status/1242151933441343490	201 са общо случаите на COVID-19 https://t.co/0rIyrDXuIy	1
COVID-19	1261295215501074432	http://twitter.com/user/status/1261295215501074432	Лекарството за Covid-19 се засича като тежка дрога от КАТ https://t.co/dJfBzOltYj Сега всички наркомани ще трърдят, че се лекуват от COVID-19...	0
COVID-19	1256520444653510657	http://twitter.com/user/status/1256520444653510657	(Лекарство убива бързо COVID-19!) от Зарата - Новини - https://t.co/AjSsI76jZw #новини #коронавирус https://t.co/XDSiF7gI0h	0
COVID-19	1253266722221690880	http://twitter.com/user/status/1253266722221690880	Софийският университет пусна сайт за истинска информация за Covid 19https://www.skandal.bg/news/15876370282885/sofiyskiyat-universitet-pusna-sayt-za-istinska-informatsiya-za-covid-19	0
COVID-19	1290898466646814720	http://twitter.com/user/status/1290898466646814720	Здравният министър: Излекуваните са повече от заболелите от COVID-19 (ВИДЕО) https://t.co/hcyTNJ7CRc	0
COVID-19	1268389286992379908	http://twitter.com/user/status/1268389286992379908	Северна Македония върна карантината заради COVID 19 https://t.co/sG638hbVV4	0
COVID-19	1296806735324295168	http://twitter.com/user/status/1296806735324295168	Министър Ангелов в Бургас: Запазва се трайното намаляване на заболеваемостта от Covid-19 https://t.co/HCJzQ0r0N3 via @poligraff.net	0
COVID-19	1287288497913634816	http://twitter.com/user/status/1287288497913634816	Е то значи не здравната система ще се срине... .. РЗИ ще изпусне контрола.. Т.е. всички дарения на прасчо и тоя щаб и все са били за да се приберат едни пари..... https://t.co/ZQCxgLU4ia	0
COVID-19	1288472682640609287	http://twitter.com/user/status/1288472682640609287	Ваксините срещу COVID-19 ще действат максимум година https://t.co/jQ1rXrzECl	1
COVID-19	1277806576129245185	http://twitter.com/user/status/1277806576129245185	140 нови случаи на COVID-19, има oще 4 жертви https://t.co/einjE5vG6S	1
COVID-19	1273874209081622528	http://twitter.com/user/status/1273874209081622528	Да мислим още сега за производството на ваксина срещу COVID-19, призова Мария Габриел https://t.co/goNiED7jCv	0
COVID-19	1257951115066273794	http://twitter.com/user/status/1257951115066273794	Още петима са заразени с Covid-19 в полета от Нидерландия https://t.co/keFVbYYqL9	1
COVID-19	1277831719366860805	http://twitter.com/user/status/1277831719366860805	5 нови случая на Covid-19 са регистрирани в Бургас през последното денонощие, 140 заразени са установени в цяла България https://t.co/QXYJQfK7xz	1
COVID-19	1252513660003639296	http://twitter.com/user/status/1252513660003639296	Сингапур е огнището на Covid-19 в Югоизточна Азия https://t.co/sN6qCkLiNH	1
COVID-19	1241273265533923330	http://twitter.com/user/status/1241273265533923330	Под микроскоп: Ето този „симпатяга“ причинява COVID-19 (СНИМКИ) - bTV Новините https://t.co/5cQPfsMqrd	0
COVID-19	1250443526191468544	http://twitter.com/user/status/1250443526191468544	🎮 В знак на благодарност към дисциплинираните хора, които спазват всички мерки на социалната дистанция @PlayStation правят подарък 2 безплатни игри: https://t.co/GEHFTu6Ozn #StayHome #PlayAtHome #COVID19 #SonyInteractiveEntertainment #UnchartedTheNathanDrakeCollection, #Journey https://t.co/eUPCjlzeu4	0
COVID-19	1251827807510040576	http://twitter.com/user/status/1251827807510040576	Проф. Кантарджиев разкри манипулирана ли е заразата от COVID-19 : https://t.co/odbEXBdbGT https://t.co/578IRomApO	1
COVID-19	1270333564492677120	http://twitter.com/user/status/1270333564492677120	23,4 % са болните с COVID-19 медици в Сливен https://t.co/qgAt07Gtfj	1
COVID-19	1297319495221075969	http://twitter.com/user/status/1297319495221075969	Мангъров: Глупост е под карантина да е целият клас, заради един ученик с COVID-19 https://t.co/L53zw0Zvms	0
COVID-19	1270971836025667584	http://twitter.com/user/status/1270971836025667584	104 са новите случаи на заразени с COVID-19 у нас. Общият брой на заболелите е 2 993, от к... https://t.co/6ie0tBRI4Z	0
