topic	tweet_id	tweet_url	tweet_text	class_label
COVID-19	1283842779135827971	http://twitter.com/user/status/1283842779135827971	За тия, дет си мислят, че няма вирус https://t.co/bV1O5PwM5u	0
COVID-19	1256941692017614849	http://twitter.com/user/status/1256941692017614849	Отменят се част от противоепидемичните мерки, въведени заради COVID-19 у нас https://t.co/3lps5rrwQN	0
COVID-19	1293089167568785409	http://twitter.com/user/status/1293089167568785409	Oпазването на биоразнообразието 🦋🐅🐘🌴 остава приоритет и за външната дейност на ЕС 🇪🇺. Отделяме6⃣ млн. евро в помощ на опазването на застрашени видове в държави от Африка, Карибския регион и Тихия океан, силно засегнати от пандемията #coronavirus. ➡ https://t.co/SpP9ljubt7 https://t.co/07I0TnBSfz	0
COVID-19	1252279781372149766	http://twitter.com/user/status/1252279781372149766	Кратък обзор над мерките в сградостроителството взети в Хонг Конг след SARS през 2003 и промените в урбанизацията при предишни чуми. https://t.co/2Upr2Wc0Bw	0
COVID-19	1260568724584759300	http://twitter.com/user/status/1260568724584759300	Нова платформа за споделяне на добри практики от сектора на спорта свързва представители от министерствата на спорта във всички държави членки. 🥎🏊‍🏸⚽🤸‍ Проектът е стартиран от комисар @GabrielMariya и цели по-бързо възстановяване на сектора от кризата с #COVID19! https://t.co/pCZXKEXfqm	0
COVID-19	1284010236546887682	http://twitter.com/user/status/1284010236546887682	80% от активните фармацевтични съставки и 40% от готовите лекарства, които се продават в Европа, се произвеждат в Китай и Индия. Това е сред факторите, повишаващи риска от липси. ЕП предлага насърчаване на производството в Европа: https://t.co/CxyTWR57y0 #ЕвропаСрещуCOVID19 https://t.co/oA86Kd1pZe	0
COVID-19	1239148716956712960	http://twitter.com/user/status/1239148716956712960	#WeekendRead За разпространeнието на #COVID19 и реалния ефект от социалното дистанциране 👉 Научен поглед от @HorizonMagEU 👇 (да се чете от вкъщи 🏡! ) https://t.co/UmmY8AwdwM	0
COVID-19	1263354587303428096	http://twitter.com/user/status/1263354587303428096	#ЕвропаСрещуCOVID19 Независимо от ограниченията, можем да окажем значителна помощ на хора по предните линии на борбата с пандемията. Сара от Мадрид е учителка, но е решила да помогне на здравните работници в Испания, като изработва маски в дома си: https://t.co/pQYGM461ZG https://t.co/gorkO9CmXV	0
COVID-19	1248794144954355713	http://twitter.com/user/status/1248794144954355713	Единната интегрална природа все повече ни се разкрива и затова се усещаме в падение, все повече несъответстващи на единната природа. Нейната реакция на несъответствието са катаклизми и вируси. Но това не е наказание а стремеж да ни уравновеси нас с природата! М. Лайтман #covid19	0
COVID-19	1239844786267475970	http://twitter.com/user/status/1239844786267475970	Според изследване, #COVID19 оцелява до 3 часа в аерозоли във въздуха, до 24 часа на хартиена и около 2-3 дни на стоманена или пластмасова повърхност. https://t.co/DTTDwfwV7x	0
COVID-19	1283645135356657664	http://twitter.com/user/status/1283645135356657664	Новината, че са открили Covid-19 в сперма трудно ще се преглътне от някои.	0
COVID-19	1291717615061274625	http://twitter.com/user/status/1291717615061274625	Хубаво е във всеки урок да участват технологии - Даниела Попова е преподавател по музика СУ “Св. Патриарх Евтимий” гр.Пловдив: https://t.co/rwKEc6Q989 #COVID19 #GoogleClassroom #KarafunStudio #MicrosoftTeams #Office365 #БАИТ https://t.co/deGb2tZhld	0
COVID-19	1265216274566610944	http://twitter.com/user/status/1265216274566610944	В интервю за ТВ Европа посланик @frobine говори за впечатленията си от 🇧🇬, отговора на кризата с #Covid19 във 🇫🇷 и 🇪🇺 и връзките между дипломацията и науката. 👉 https://t.co/E5lHUAX4yH https://t.co/iv2ybbftwP	0
COVID-19	1257958994913554436	http://twitter.com/user/status/1257958994913554436	🎙️👨‍💻Марио Пешев, Изпълнителен Директор и WordPress Architect на @wpdevrix ще вземе участие в дискусията „ИТ секторът в режим COVID-19″ - част 2: https://t.co/KyCvMlBC9Y @no_fear_inc, #TechInfluencer, #Developer, #Manager, #ITIndustry, #Business, #Software, #Architect, #WordPress https://t.co/GyxkJ5pKcd	0
COVID-19	1297079056052170754	http://twitter.com/user/status/1297079056052170754	#ЕвропаСрещуCOVID19 В първите дни от извънредното положение Националният младежки форум започна кампанията #ВремеЗаТеб и организира серия от безплатни уебинари, които да помогнат на младежи да усъвършенстват уменията и компетентностите си, докато са вкъщи: https://t.co/sxkjHuiAoc https://t.co/sTYQRKTgnn	0
COVID-19	1247950338990190592	http://twitter.com/user/status/1247950338990190592	Антиваксери на апарати. Буквално ! https://t.co/q1zvQT8jb0	0
COVID-19	1242023990018945025	http://twitter.com/user/status/1242023990018945025	5 съвета за маските и коронавируса от Световната здравна организация. #WorldHealthOrganization #coronavirus #COVID19 https://t.co/XBFsvIFpxN	0
COVID-19	1253585047279611907	http://twitter.com/user/status/1253585047279611907	THE BIG CHANGE: Covid-19 и климатичната криза Очакваме ви на втората ни онлайн дискусия, посветена промяната в света след коронавируса: на 29 април ще си говорим за COVID-19 и климатичните промени. #movebg #editbg #climatechange #webinar #society #CHANGE https://t.co/v1oZHHzToZ	0
COVID-19	1245630362497105925	http://twitter.com/user/status/1245630362497105925	Пиратството процъфтява на държавно ниво https://t.co/Q4Dvelqr6d	0
COVID-19	1269942605883809792	http://twitter.com/user/status/1269942605883809792	Служителите в хранителните магазини останаха на работните си места по време на разгара на кризата с коронавируса. Ванеса, която работи в хранителна верига, разказа за предизвикателствата, но и уроците по време на кризата: https://t.co/gYpUY5Hk7N #ЕвропаСрещуCOVID19	0
COVID-19	1236415647854276609	http://twitter.com/user/status/1236415647854276609	Това, че вече има потвърден COVID-19 в БГ не променя ситуацията с много. Беше ясно, че няма как да останем встрани и че е въпрос на време да се открият. Но поне слага край на двете безумни теории: има, но ги крият и няма заради аурата на Б.Б..	0
COVID-19	1255520478749511688	http://twitter.com/user/status/1255520478749511688	Международния център @NizamiGanjaviIC 🇦🇿 помага на #България в борбата с #COVID19 . @PresidentOfBg @MFABulgaria @NarodnoSabranie @MoEBulgaria https://t.co/1YuyBHfrYs https://t.co/gKKPhEjPDe	0
COVID-19	1250807980800520199	http://twitter.com/user/status/1250807980800520199	Вече започнахме: на живо първият от специалните онлайн уебинари на https://t.co/q8sdnz7A5f. Говорим си за предизвикателствата и новите измерения на свободата, свързани с COVID 19 започва. Гледайте го тук: https://t.co/0PG2XUsltn #movebg #editbg https://t.co/3n7Oc6dpqU	0
COVID-19	1253631826255581184	http://twitter.com/user/status/1253631826255581184	Коронавирусът е особена програма, заредила се в общия компютър, наречен човечество и е започнала да работи в него. Тази програма иска от нас по-голямо взаимно включване. Ако го постигнем, то ще се справим с вируса. А дотогава ние се учим само от страданията. М. Лайтман #covid19	0
COVID-19	1245038870284075009	http://twitter.com/user/status/1245038870284075009	Проверeте статистикaта: там където хората са по-близки, усещат общия #социум, там загубите от #coronavirus са много по-малки. Колкото повече #обществото е разделено, толкова повече са жертвите от #короновируса. Михаел Лайтман #StayAtHome	0
COVID-19	1237842276832792578	http://twitter.com/user/status/1237842276832792578	Озадачена от извадката от разпореждането на партиарха, реших да потърся цялото писмо. Което всъщност звучи много практично и разумно и освен за молитви говори за конкретни мерки в храмовете. Не ставайте папагали! https://t.co/LtnwM9BDPj	0
COVID-19	1242073540154789890	http://twitter.com/user/status/1242073540154789890	Полицията в Мадрид забранява ловенето на покемони по време на извънредното положение. https://t.co/FoZRyfjM61	0
COVID-19	1270962007647440896	http://twitter.com/user/status/1270962007647440896	Нова програма на ЕС цели да укрепи системите на здравеопазване в Европа и да ги подготви по-добре за бъдещи кризи като пандемията от COVID-19: https://t.co/YKDqBQNQOY #ЕвропаСрещуCOVID19 https://t.co/e2D0udgOpM	0
COVID-19	1231857531955314688	http://twitter.com/user/status/1231857531955314688	🔴🎥 Пресконференция за действията на ЕС в контекста на кризата с #coronavirus. За превод на български 🇧🇬👉https://t.co/0D9ssMmrlz https://t.co/m25VRSyP8t	0
COVID-19	1254681072564088832	http://twitter.com/user/status/1254681072564088832	Европейският фонд за най-нуждаещите се осигурява храна и материална помощ за тези, които имат най-голяма нужда от тях.🙌🇪🇺 Заради #coronavirus правилата на фонда бяха променени, за да позволят осигуряването на предпазни средства и лечение, вкл. за доброволци и социални работници. https://t.co/zvOVTDXvVI	0
COVID-19	1284018759255154688	http://twitter.com/user/status/1284018759255154688	#COVID19 преобърна живота ни наопаки, но има неща, които не се променят - желанието ни да сме заедно и да попълваме албума на спомените. Да пътуваме в Европа! Тя чака да бъде преоткрита. #GoEuropean @EPPGroup https://t.co/YbgDfodTes	0
COVID-19	1285612153614020609	http://twitter.com/user/status/1285612153614020609	COVID-19 и технологичните общности в България: https://t.co/XEIPo5sEHD #WomenWhoCodeSofia @googledevs #GDG #covid_19 #usergroups #ReactJS #Bulgaria #SofiaCryptoMeetup #Django #PHP #Flutter #Kotlin #ReactJS #Java #Python #community #tech https://t.co/ZErGu9tfsG	0
COVID-19	1271422748208791554	http://twitter.com/user/status/1271422748208791554	Видео-конференция на Бюрото на Европейския парламент - „Поуките за Европа след COVID-19; Как ЕС да бъде по-подготвен за бъдещи подобни предизвикателства“, в която участвах заедно с моите колеги Ангел Джамбазки и Петър Витанов. https://t.co/zJ7gI7NjgQ	0
COVID-19	1256532557673480192	http://twitter.com/user/status/1256532557673480192	Андерс Тегнел,гл епидемиолог на Швеция ,държавата ,която се протипопостави на мейнстрийма. Доказани професионализъм и отговорност! Сравнете го със смешниците Борисов и НОЩ! https://t.co/nD4r7yh6T1	1
COVID-19	1238923080006873090	http://twitter.com/user/status/1238923080006873090	Френският министър на здравеопазването предупреждава при симптоми на грип да не се приема ибупрофен, тъй като може да усложни заболяването. Казва при температура да се взима парацетамол. https://t.co/pJXnEx2DPW	0
COVID-19	1253559503183888384	http://twitter.com/user/status/1253559503183888384	90 нови случая на COVID-19 са потвърдени у нас за последните 24 часа https://t.co/eyh5r90RN8	0
COVID-19	1249390214696632320	http://twitter.com/user/status/1249390214696632320	Днес не исках да изляза на разходка. Днес исках просто да си кажа последно сбогом с баба, жената, която ме отгледа. Fuck you corona.	0
COVID-19	1260973306649378830	http://twitter.com/user/status/1260973306649378830	Изключително интересна виртуална среща с учениците от ПЕГ Екзарх Йосиф I - Ловеч на актуални теми: какво прави ЕС срещу #coronavirus, политиката на сближаване и киберсигурността и дезинформацията, #ErasmusPlus. Благодарности на @ECinBulgaria. #StrongerTogether #EUBacktoSchool https://t.co/pUnd6GCgPt	0
COVID-19	1243214954326614018	http://twitter.com/user/status/1243214954326614018	#COVID19 В този кризисен момент е важно да улесним въздушния превоз на товари в ЕС 📦 и да избегнем голям ръст в разходите. Ето препоръките на ЕК към държавите-членки, за да сме сигурни, че основните транспортни потоци няма да пострадат 🛬🛬🛬https://t.co/7yia7ORS4A https://t.co/ZwBnB0yPNz	0
COVID-19	1257666397175504897	http://twitter.com/user/status/1257666397175504897	Днес стартира платформата Creatives Unite – място за обмяна на опит и идеи между професионалисти от културния и творчески сектор в Европа. 🎭🎨🎬🎤🤹 Целта е намиране на общи решения за кризата в сектора, свързана с #coronavirus https://t.co/9QfZAaurbY	0
COVID-19	1280424801383993345	http://twitter.com/user/status/1280424801383993345	Лятната икономическа прогноза на ЕС #ECForecast ☀ показва по-силна от очакваната рецесия, предизвикана от кризата с #coronavirus. #NextGenerationEU и подсилен #EUBudget могат да дадат тласъка за бързо възстановяване. ➡ https://t.co/Qkg18kjN9Q https://t.co/VPLEmR1RI2	0
COVID-19	1243219464507789313	http://twitter.com/user/status/1243219464507789313	Подкрепих българските медици, работещи в условия на пандемия! Направете го и вие с текст SOLIDARNOST на номер 17 777 👩🏻‍⚕️👨🏼‍⚕️🇧🇬 #solidarity #COVID19 https://t.co/3XMltZRhMu	0
COVID-19	1276185622429020162	http://twitter.com/user/status/1276185622429020162	Броят на заразените с Covid-19 в последните дни показва, че българската клубна сцена е в подем.	0
COVID-19	1260829906054844416	http://twitter.com/user/status/1260829906054844416	Сигурно ви е писнало от чумата, но това е един от най-дълбоките и проницателни епизоди които сме правили с изключително проницателен събеседник https://t.co/t2jYqwitsO	0
COVID-19	1292371034126065665	http://twitter.com/user/status/1292371034126065665	Европейския икономически и социален комитет учредява специална „Награда за гражданска солидарност“ за проекти за борба срещу #COVID19 и последиците от него. @EU_EESC ще присъди до 29 награди, всяка в размер на €10 000: https://t.co/IRul47jHlU #CivilSolidarityPrize https://t.co/u8SGH19nqr	0
COVID-19	1233109558115098626	http://twitter.com/user/status/1233109558115098626	Официални кадри от пристигането на #coronavirus в България. 💀☠️ https://t.co/glt61Myido	0
COVID-19	1254178801325608960	http://twitter.com/user/status/1254178801325608960	Начи, преживяла съм: Чернобил - 86 г. Купонната с-ма - 90г. Краха на СССР - 91г. Голямата инфлация - 96г. BSE - 07г. Н5N1 - 07г. H1N1 - 09г. Фукушима - 11г. Ебола - 14г. И до тук - COVID-19 - 20г. И няколко края на света... Че аз направо съм си ветеран от Апокалипсиса, бе, хора!	0
COVID-19	1242396242472247296	http://twitter.com/user/status/1242396242472247296	ЕС ще подкрепи кампанията на @who за глобален отгвор срещу #COVID19 с 114 млн. евро, за да помогне на по-неустойчивите здравни системи по света да се справят със заплахата. 🌍 15 млн. е финансирането досега за диагностика и наблюдение в Африка #solidarity https://t.co/Kfn3ksj5Nw	0
COVID-19	1273141258094084096	http://twitter.com/user/status/1273141258094084096	Чрез Инвестиционната инициатива в отговор на коронавируса, 750 милиона евро са мобилизирани в помощ на България за справяне с настоящата криза и ефектите ѝ: https://t.co/FWaFQ3Z1k2 #ЕвропаСрещуCOVID19 https://t.co/1GLkyr0fad	0
COVID-19	1237804966225608711	http://twitter.com/user/status/1237804966225608711	ПАНДЕМИЯ ПАНДЕМИЯ ПАНДЕМИЯ ПАНДЕМИЯ ПАНДЕМИЯ ПАНДЕМИЯ ПАНДЕМИЯ ПАНДЕМИЯ ПАНДЕМИЯ ПАНДЕМИЯ https://t.co/WRNQUuVsWL	0
COVID-19	1247056560901275649	http://twitter.com/user/status/1247056560901275649	39 са вече излекуваните пациенти от COVID-19 в България https://t.co/0DRISBcJal	0
COVID-19	1267120401102049281	http://twitter.com/user/status/1267120401102049281	Защитавайте себе си и останалите от коронавируса, като спазвате дистанция, когато говорите с други хора, пазарувате 🛒 или използвате обществен транспорт 🚌. #ЕвропаСрещуCOVID19 🇪🇺 https://t.co/qSf5hrmnU7	0
COVID-19	1283733731975536640	http://twitter.com/user/status/1283733731975536640	Днес Испания отдава почит на повече от 28 хил. души, които загубиха живота си вследствие на #COVID19. ЕС скърби с Испания и с всички европейци, чийто живот се преобърна заради болестта! 🇪🇸 🇪🇺 https://t.co/sTlwIEBA8Q	0
COVID-19	1227899752093769728	http://twitter.com/user/status/1227899752093769728	Зимна #ECForecast ❄: 📌 1.4% ръст на БВП за ЕС през 2020 и 2021 (от 1.5% през 2019) 📌 Инфлация от 1.5% за 2020 и 1.6% за 2021 Рискове ➡ Несигурност в глобалните търговски отношения, геополитически конфликти, неяснота в отношенията с 🇬🇧, #Coronavirus ➡ https://t.co/flhncqJMk0 https://t.co/uzpz272hgs	0
COVID-19	1284066125949673474	http://twitter.com/user/status/1284066125949673474	Бирата Corona хубу решили да стартират положителна рекламна кампания в тия КОВИД времена, ама що със слогана “На крачка от рая” 😳	0
COVID-19	1236759350645075970	http://twitter.com/user/status/1236759350645075970	Как да се пазим, къде да не пътуваме. Препоръките на институциите за COVID-19 https://t.co/23zqceFAOO	0
COVID-19	1248596103920062465	http://twitter.com/user/status/1248596103920062465	Говорителят на ЕП @jduch пред @vestnikstroitel за COVID-19 и последиците: "Няма по-добро решение от това да правим нещата заедно. Кризите се разпростират далеч извън границите и вече няма смисъл да се опитваме да ги решаваме поотделно." Прочетете интервюто:https://t.co/pV0PR4DNFe	0
COVID-19	1268430044784984064	http://twitter.com/user/status/1268430044784984064	От години Аделина помага на хора с трайни увреждания, които имат нужда от подкрепа. Отскоро нейна кауза е да погне и на хората, които искат да доброволстват - да знаят какво ги очаква и как да помагат ефикасно: https://t.co/PttNjvbFNQ #ЕвропаСрещуCOVID19	0
COVID-19	1275741043678498818	http://twitter.com/user/status/1275741043678498818	Covid19 постави САЩ на колене, каза д-р Редфийлд, директор на центровете за контрол и превенция на заболяванията. Страната ще похарчи 7трлн. USD за откриване на нови случаи на вируса. Чудя се, вместо това просто да започнем да живем по нов начин, оставяйки само необходимото. М.Л.	0
COVID-19	1251758171523293190	http://twitter.com/user/status/1251758171523293190	Отвратително. Всеки път, когато видя писъци колко страшни ни били ограниченията, наложени от щаба НИ - мъчител и диктатор, ще отговарям с този клип. Запазвам си го. Не разбирам как някои не разбират, че заради тях не стигнахме до положението им. Е, и заради бцж-то де. https://t.co/0ARISaDeEX	0
COVID-19	1300006335052943365	http://twitter.com/user/status/1300006335052943365	Бъдете свободни. Не живейте в страх. Нищо особено няма в тоя вирус! https://t.co/EcDorDvMqG	0
